audio_446.wav," My school background is very large in size. It has some grass on it and some area has not big grass. The sound I hear is about boys playing and girls are also playing. In this ground everybody plays some football, cricket, tennis, badminton, covered D and X-Ecta. At the edges of the ground there are stairs where we are made to see, sit and watch the game. Everybody is playing with the games and enjoying their life and forget about others.",-366.7072,162.68779,80.47869,62.612125,-13.847914,38.04416,20.05796,34.08667,-7.6672735,23.365444,-6.5174446,18.255156,-7.9367027,15.693415,-5.346707,14.052682,-4.5885158,11.411703,-9.6349,14.635637,1.9271315,10.040593,-7.1860933,10.194191,-2.062825,8.050711,0.42374977,0.33173475,18.632615630217504,6.016077344604572,0.0067916080771287,0.1384192374937762,0.1519407882600354,0.04342807,3.0
audio_447.wav," When the school playground provides a safe outdoors environment within the school, that stimulates children to use their creative energy in the healthy interactions. The most enhancing schools always have large open playgrounds with interesting playing equipment like swings, rollers etc. Open playgrounds with interesting play equipment that plays many options for the creativity. The playgrounds must be spacious and outdoors but they almost and must also to be scheduled so that the children have feel safer and do not have to consider the outside world. A good playground will allow for anyone on the playground to see all that is",-280.28162,88.73685,75.24667,38.32688,-15.526146,32.932484,24.829615,35.413532,-19.89972,25.44257,12.087076,16.007378,-6.452376,13.428057,-7.1118407,20.665903,-5.6589017,15.159127,-0.5981306,11.076688,-4.424638,12.576664,-12.657742,14.762201,4.7925363,11.526893,0.363173,0.31564596,19.29882983317344,6.078954412234434,0.0028063919161249,0.111111999782656,0.1921826119874866,0.044299107,3.0
audio_45.wav," 1.5% de la cacao 1.5% de la cacao 1.5% de la cacao 1.5% de la cacao 1.5% de la cacao 1.5% de la cacao 1.5% de la cacao 1.5% de la cacao 1.5% de la cacao 1.5% de la cacao 1.5% de la cacao 1.5% de la cacao 1.5% de la cacao 1.5% de la cacao 1.5% de la cacao 2.5% 2.5% de la cacao 1.6% de la cacao 2.5% de la cacao 1.5% de la cacao 1.5% de la cacao 3.5% de la cacao Shhh, shhh, shhh, shhh, shhh, shhh, shhh, shhh, shhh, shhh, shhh, shhh, shhh, shhh, shhh, shhh, shhh, shhh, shhh, shhh, shhh, shhh, shhh, shhh, shhh, shhh, shhh, shhh, shhh, shhh, shhh, shhh, shhh, shhh, shhh, shhh, shhh, shhh, shhh, shhh, shhh, shhh, shhh, shhh, shhh, shhh, shhh, shhh, shhh, shhh, shhh, shhh, shhh, shhh, shhh, shhh, shhh, shhh, shhh, shhh, shhh, shhh, shhh, shhh, shhh, shhh, shhh, shhh, shhh, shhh, shhh, shhh, shhh, shhh, sh shhh shhh shhh, shh shhh, shhh shhh, shhh, shhh, shhh shhh, shhh shhh, shhh, shhh, shhh shhh Changbysana, Buzza, Klaat, Buzza, Buzza, Buzza, Buzza, Buzza, Buzza, Buzza, Buzza, Buzza, Buzza, Buzza, Buzza,",-375.88687,77.29636,51.45274,53.04226,15.518511,30.675785,20.909838,26.004278,4.0902534,16.56587,25.866697,21.703348,5.5523624,15.604167,6.9822755,11.928507,12.527446,13.7043085,2.2910848,10.989749,-0.06652025,12.503836,-3.1092896,12.088959,4.29833,7.503958,0.51989394,0.32167912,20.17261606313407,8.472120988839126,0.0050167592908046,0.151232697173311,0.1487165044865344,0.03080975,2.5
audio_450.wav," My favorite place to visit is a warm sunny beach. I love hearing the oceans crash. I love the smell of the ocean. I love running my fingers to the sand. The best time to go. Sunrise. Sun down are both really good times to go. But in general, you can go at all times. Even at night, even though the ocean gets bit scary, it's still peaceful. And calm, being next to a big body of water, like the ocean. So I would definitely say, going to the beach.",-432.23505,139.414,59.586308,82.366684,2.6907141,33.275932,15.073397,33.32993,-2.607789,20.264658,-0.56981486,17.800285,-6.674638,17.838833,-6.334341,14.522374,-8.162399,13.700532,-8.7548275,14.003468,-7.1919127,10.871101,-4.799405,8.7087555,-4.5228033,9.066492,0.46080923,0.31288454,17.903039455193447,5.499275861279289,0.0224582717387401,0.122660973352917,0.2056025463425186,0.03060672,5.0
audio_455.wav, Sarthofнач tá werич te感じi ihm si u be it te kae g movie de y y y A sa da da ska da ska da ska da da ska da da ska da da ska da da ska da da ska da da ska da da ska da da ska da da ska da da ska da da ska da da ska da da ska da da ska da da ska da da ska da da ska da da ska da da ska da da ska da da ska da da ska da da ska da da ska da da ska da da ska da da ska da da ska da da ska da da ska da da ska da da ska da da ska da da ska da da ska da da ska da da ska da da ska da da ska da da ska da da ska da da ska da da ska da da ska da da ska da da ska da da ska da da ska da da ska da da ska da da ska da da ska da da s hate toa raсы ge huge ya da a da todasumm em Uda Uda Uda Uda Uda Uda Uda Uda Uda Uda Uda Uda Uda Uda Uda Uda Uda Uda Uda Uda Uda Uda Udaصل Uda Uda Uda sci quale tri dir su B gettin' it up ziet,-366.02902,106.96144,61.456768,69.45852,6.4588556,57.32459,44.210155,40.842316,-14.969049,27.69482,43.233433,26.852282,2.7959652,22.737944,12.3624,18.840618,3.2957773,18.363487,-2.1822126,15.070292,-0.7071766,12.759548,-3.2127135,12.262026,4.0349765,12.421552,0.38226447,0.31232962,22.57613799762671,9.301865660896974,-0.0066687086347847,0.1426536508930715,0.1339363356836943,0.04153269,4.5
audio_460.wav," So my favorite place to visit is London. I usually take a direct flight from Tokyo, which is around 14 hours. It's longer because of the war in Ukraine. Some local foods are dishes that I love from London. I do love their Indian food because they do have a large Indian population as well as their calf beer because they do have a lot of breweries that I like are based in London. My favorite time of course season to visit is usually June or July because it doesn't rain as much as the rest of the year and because there are outdoor concerts and Wimbledon is on and there are lots of activities that you can do at stores.",-316.9546,125.33232,76.52805,63.52972,10.326954,41.164215,11.601277,32.84235,-13.535963,23.04681,-9.176226,20.893862,-16.545095,17.711073,-11.564414,15.674707,-3.4942596,15.239626,-1.0181811,10.6961,-5.1037326,10.249326,-9.325614,12.090621,-2.815195,9.81605,0.33615032,0.32998946,20.18070204665049,6.325159686698824,-0.0134783219171746,0.1667218123055941,0.1525730476939203,0.064567395,4.5
audio_462.wav," So one of my favourite places to visit is Auckland where I grew up. So it's not too far from here, it's about a three hour plane trip and then you land at the Auckland International Airport. I always love the airports because of how busy they seem. It seems like they never sleep at an airport and I love the vibe. It's like get there one of my favourite places to go. There are actually two favourite places. I like to go to the CBD just because it's so vibrant there. And there's a whole bunch of places I like. There's a place that does a really good routine. I visited there recently and their standards haven't slipped at all and they also have this lovely popcorn. And there's a little park that I like to visit during the golden hours and the view is just phenomenal from there. It's just so peaceful and lovely.",-254.33786,117.89129,62.01743,78.11114,-4.3041654,50.65634,5.488159,36.76055,-26.645086,31.541082,0.030044507,24.060768,-19.15361,20.735731,-10.547534,17.50724,-4.517875,15.42582,-4.4134097,13.527762,-11.192558,12.244366,-5.643433,12.347676,-1.0373887,10.815366,0.36958885,0.31225803,19.56294061551965,6.010448560324189,-0.0040152530790165,0.1241511042909302,0.202925839490149,0.061948262,5.0
audio_463.wav, I'm going to have to go back to the room. I'm going to have to go back to the room. I'm going to have to go back to the room. I'm going to have to go back to the room. I'm going to have to go back to the room. I'm going to have to go back to the room. I'm going to have to go back to the room. I'm going to have to go back to the room. I'm going to have to go back to the room. I'm going to have to go back to the room. I'm going to have to go back to the room. I'm going to have to go back to the room. I'm going to have to go back to the room. I'm going to have to go back to the room. I'm going to have to go back to the room. I'm going to have to go back to the room. I'm going to have to go back to the room.,-427.17456,87.22459,116.3041,72.41453,31.62579,61.083996,8.336657,37.08409,11.234279,29.22846,14.82002,29.042614,18.186436,28.778543,13.74924,26.880732,10.655725,20.201113,8.990841,16.635937,2.5349236,14.205049,-0.8817009,13.349484,-0.31432116,11.810385,0.45344222,0.30566514,19.93636716261496,7.028504353995792,-0.0028357991325204,0.1354775407348956,0.0687214468589117,0.05143333,5.0
audio_464.wav," gehen decorative chordsgel Heritagerig Frog I'm not a bad guy, I'm not a bad guy, I'm not a bad guy, I'm not a bad guy, I'm not a bad guy, I'm not a bad guy, I'm not a bad guy, I'm not a bad guy, I'm not a bad guy, I'm not a bad guy, I'm not a bad guy, I'm not a bad guy, I'm not a bad guy, I'm not a bad guy, I'm not a bad guy, I'm not a bad guy, I'm not a bad guy, I'm not a bad guy, I'm not a bad guy, I'm not a bad guy, I'm not a bad guy, I'm not a bad guy, I'm not a bad guy, I'm not a bad guy, I'm not a bad guy, I'm not a bad guy, I'm not a bad guy, I'm not a bad guy, I'm not a bad guy, I'm not a bad guy, I'm not a bad guy, I'm not a bad guy I'm not a bad guy, I'm not a bad guy, I'm not a bad guy, I'm not a bad guy. Just work it out. A bad guy. Not a bad guy, I'm not a bad guy. I'm not a bad guy, I'm not a bad guy.",-340.14795,119.14118,78.207344,65.449,-8.977401,48.60083,36.74279,38.004326,-26.734467,26.293644,39.894356,26.54746,3.7752564,22.774086,3.9300594,20.290009,24.797453,16.307735,13.7377,16.52,13.630522,14.961565,-3.312499,12.914951,-2.5782092,12.997045,0.42058694,0.30730525,23.459311745474437,9.92481401955889,-0.0139073145716005,0.1366063362132695,0.1288984012212002,0.048354518,5.0
audio_468.wav," I'm not much of a traveler, so this is going to be a bit of a lacking answer. So typically, because I'm more of a stay-at-home sort of person, an introvert, I don't go out much, but I do, in particular, enjoy walking, basically, touring neighborhood and such. And there is one particular route to that. I particularly enjoy, once you get past a few blocks, is one of the few places here that's left that's not been developed. So it's still essentially bushland to a certain degree. You go to the pass some buildings and down a small slope, and on your left you have what is essentially left over farmland and such, and I'm taking too long to explain this. You go down the road, there's more bushland, there's a lot of trees and such, and it has some traffic that's generally slurring.",-282.22437,141.21898,41.15451,73.95805,-24.72104,38.961136,7.493262,29.551153,-11.618929,25.496384,-16.859322,20.115093,-20.680649,17.395292,-8.442537,14.094822,-25.122837,19.377192,4.7385983,15.534405,-14.181961,11.919555,-7.351944,10.088744,-7.7376065,9.270783,0.39979514,0.30578217,18.126500407166574,5.148228680836245,-0.0063495435504591,0.1081337300406958,0.2261792590189031,0.04238913,4.5
audio_469.wav, I'm sorry. I'm sorry. I'm sorry. I'm sorry. I'm sorry. I'm sorry. I'm sorry. I'm sorry. I'm sorry. I'm sorry. I'm sorry. I'm sorry. I'm sorry. I'm sorry. I'm sorry. I'm I'm I'm I'm I'm Shouldn't I'm going to be a little bit more careful. I'm going to be a little bit more careful. I'm going to be a little bit more careful. I'm going to be a little bit more careful. I'm going to be a little bit more careful. I'm going to be a little bit more careful. I'm going to be a little bit more careful. I'm going to be a little bit more careful. I'm going to be a little bit more careful. I'm going to be a little bit more careful. I'm going to be a little bit more careful. I'm going to be a little bit more careful. I'm going to be a little bit more careful. I'm going to be a little bit more careful. I'm not sure if I can do it. I'm not sure if I can do it. I'm not sure if I can do it. I'm not sure if I can do it. I'm not sure if I can do it. I'm not sure if I can do it. I'm not sure if I can do it. I'm not sure if I can do it. I'm not sure if I can do it. I'm not sure if I can do it. I'm not sure if I can do it. I'm not sure if I can do it. I'm not sure if I can do it. I'm not sure if I can do it. I'm not sure if I can do it.,-360.98682,106.97022,74.074814,67.36428,17.590149,67.57951,39.36963,30.2787,-5.680202,28.263258,37.43613,23.32262,-4.5304093,23.575375,17.750134,17.209312,9.670643,17.081406,10.429887,16.445868,12.383377,13.125656,4.3631988,10.89146,17.332594,14.4575405,0.46122998,0.29133716,22.270909958132787,9.48369452612397,-0.0281893915636374,0.1156927399338027,0.1345983282109888,0.053641163,4.0
audio_471.wav," Ruta, s'agglis, hapol, fraz, hikol, fraz, hikol, fraz, hikol, fraz, hikol, fraz, hikol, fraz, hikol, fraz, hikol, fraz, hikol, fraz, hikol, fraz, hikol, fraz, hikol, fraz, hikol, fraz, hikol, fraz, hikol, fraz, hikol, fraz, hikol, fraz, hikol, fraz, hikol, fraz, hikol, fraz, hikol, fraz, hikol, fraz, hikol, fraz, hikol, fraz, hikol, fraz, hikol, fraz, hikol, fraz, hikol, fraz, hikol, fraz, hikol, fraz, hikol, fraz, hikol, fraz, hikol, fraz, hikol, fraz, hikol, fraz, hikol, fraz, hikol, fraz, hikol, fraz, hikol, fraz, hikol, fraz, hikol, fraz, hikol, fraz, hikol, fraz, hikol, fraz, hikol, fraz, hikol, fraz, hikol, fraz, hikol, fraz, hikol, fraz, hikol, fraz, hikol, fraz, hikol, fraz, hikol, fraz, hikol, fraz, hikol, fraz, hikol, fraz, hikol, fraz, hikol, fraz, hikol, fraz, hikol, fraz, hikol, fraz, hikol, fraz, h hivol, fraz, hikol, fraz, hikol fraz, hikol, fraz, hikol, fraz, hikol, fraz, hikol, fraz, hikol, fraz, hikol, frazo' Le envование therapy o compl Considering trees and huddles Fl Tas Lever why is wearing black here hamo Kapou I'm wearing red A fl observer或 winter A-W-O-O-O-O-O-O-O-O-O-O-O-O-O-O-O-O-O-O-O-O-O-O-O-O-O-O-O-O-O-O-O-O-O-O-O-O-O-O-O-O-O-O-O-O-O-O-O-O-O-O-O-O-O-O-O-O-O-O-O-O-O-O-O-O-O-O-O-O-O-O-O-O-O-O-O-O-O-O-O-O-O-O-O-O-O-O-O-O-O-O-O-O-O-O-O-O-O-O-O-O-O-O-O-O-O-O-O-O-O-O O-O-O-O-O-O-O-O-O-O-O-O-O-O-O-O-O-O-O-O-O-O-O-O-O-O-O-O-O-O-O-O-O-O-O-O-O-O-O-O-O-O-O-O-O-O-O-O-O-O-O-O-N-O-O-O-O-O-O-O-O-O-O-O-O-O-O-O-O-O-O-O-O-O-O-O-O-O-O-O-O-O-O-O-O-O-O-O-O-O-O-O-O-O-O-O-O-O-O-O-O-O-O-O-O-O-O-O-O-O-O",-427.29776,97.45785,90.7761,77.23058,10.0564785,74.49727,29.106688,29.145975,16.510618,25.042933,-2.7348766,21.61286,10.986599,22.965645,7.925322,21.304014,-0.3242618,15.814026,3.0049775,16.325449,3.1946683,13.588172,1.424691,11.660368,-0.9372567,11.020331,0.41601402,0.30497926,21.093989238408135,8.083369510044033,0.0069524418073369,0.1412892638343135,0.0761716152298723,0.036047664,5.0
audio_477.wav," My favorite place to visit is probably City in Asia. Like in Vietnam, the street food is just everywhere. There's so many people at nighttime. It's so bright and loud. It's just completely different to what it is here. I went in towards the winterish, but it doesn't really matter because it's kind of close to the equator. It's still very humid and hot. But despite that, the nightlife was really nice.",-392.4393,155.9247,53.425533,70.041,-11.054222,31.388588,23.025957,30.261868,-7.1465273,19.891281,0.33964753,14.32357,-15.0461855,18.807486,-4.8425403,12.483501,-0.99607056,13.677807,-5.181553,12.335711,-5.9174056,10.449953,-7.1384406,10.207078,-4.2758603,8.829197,0.3570804,0.3120956,19.61854026396336,6.582163080279142,-0.0002441127904279,0.1274483213533628,0.1443881950250836,0.037183043,4.5
audio_478.wav, I'm not sure if I can do it. I'm not sure if I can do it. I'm not sure if I can do it. I'm not sure if I can do it. I'm not sure if I can do it. I'm not sure if I can do it. I'm not sure if I can do it. I'm not sure if I can do it. I'm not sure if I can do it. I'm not sure if I can do it. I'm not sure if I can do it. I'm not sure if I can do it. I'm not sure if I can do it. I'm not sure if I can do it. I'm not sure. I'm not sure. I'm not sure. What can I do… What can happen? Veeees… I'm not sure… What can happen? Veees… Vee… I'm going to have to go to the bathroom. I'm going to have to go to the bathroom. I'm going to have to go to the bathroom. I'm going to have to go to the bathroom. Okay. Oh. Is this to Ok. Yep. I'm not sure if I'm going to be able to do it. I'm not sure if I'm going to be able to do it. I'm not sure if I'm going to be able to do it. I'm not sure if I'm going to be able to do it. I'm not sure if I'm going to be able to do it. I'm not sure if I'm going to be able to do it.,-377.5001,113.79665,74.53764,63.945374,-1.1688242,44.269848,37.32057,32.13323,-8.910029,21.441063,16.019894,17.180481,21.060587,24.211025,9.686037,19.89541,16.851425,16.630272,9.751928,13.256797,8.925575,13.867555,5.687021,11.398982,3.213875,8.87991,0.46243665,0.29827228,21.473095083171565,8.735370705175187,0.0114544558905056,0.1051334028656577,0.1264837404857536,0.036469433,4.5
audio_479.wav," The favorite place I like to visit is the Vatican city, you know, the St. Peter Basilica. You know, the journey to the place right from getting to the plane, I start having experiences of, you know, feeling of the place, what I expect to see, the cardinals, you know, the unity of the place, beautified with so much architecture. It is an architectural masterpiece, you know, the food that is served in a local container around the corner, lovely dishes, lovely menus, you know, and the most fascinated in a other place is the foods are prepared on the spot and it doesn't take much time and you will surprise at how it comes out to freely taste the unconscious, you know, especially when you go there it was evening, that's when you meet one of the best chefs I've ever met, you know.",-327.09116,139.6208,74.434814,74.445244,-23.92741,39.63252,34.346294,35.941135,3.3939033,23.18923,-7.363348,18.094936,-6.7156944,16.350569,-19.780582,19.661459,-15.888719,15.144483,3.546055,13.073299,-10.365539,12.9352455,-7.307908,9.781607,-4.2650194,10.029921,0.34673566,0.31776127,21.391433212422925,6.720389090543433,0.0105660994785885,0.145484771465587,0.1601048115664308,0.045245964,4.0
audio_480.wav,ATION I'm going to go back to the place where I'm going to go. I'm going to go back to the place where I'm going to go. I'm going to go back to the place where I'm going to go. I'm going to go back to the place where I'm going to go. I'm going to go back to the place where I'm going to go. I'm going to go back to the place where I'm going to go. I'm going to go back to the place where I'm going to go. I'm going to go back to the place where I'm going to go. I'm going to go back to the place where I'm going to go. I'm going to go back to the place where I'm going to go. I'm going to go back to the place where I'm going to go. I'm going to go back to the place where I'm going to go. I'm going to go back to the place where I'm going to go. I'm going to go back to the place where I'm going to go. I'm going to go back to the place where I'm going to go. I'm going to go back to the place where I'm going to go. I'm going to go back to the place where I'm going to go. I'm going to go back to the place where I'm going to go. I'm going to go back to the place where I'm going to go. I'm going to go back to the place where I'm going to go. I'm going to go back to the place where I'm going to go. I'm going to go back to the place where I'm going to go. I'm going to go back to the place where I'm going to go.,-374.3509,63.731155,106.23571,39.39725,53.08773,49.08709,42.49847,23.327599,-1.9162292,16.56877,14.571382,15.32733,1.5428948,13.894769,6.9846287,12.315039,10.86221,11.271345,4.3645587,11.15605,9.628023,11.9916115,8.804148,11.261333,8.12863,9.52679,0.4102467,0.30563107,20.09919616073387,7.388725902404417,-0.0023901173184627,0.1215337806433863,0.0472368118120894,0.05356543,3.0
audio_481.wav," The place that I love to journey to whenever I get to chance is an old beach town that I used to live in several years ago. Just going there, whether it's by plane or bus or train, is always part of the enjoyment. That builds up anticipation of what I plan to do once I get there. As far as whether there's a particular time of day or season in which I like to visit, no, it's just whenever I get the opportunity to do so. It's always enjoyable. It's always relaxing and it just brings back tons and tons of fun memories for me.",-375.808,148.9694,83.36221,94.41753,8.266023,40.625015,24.14086,37.89219,-3.1398704,22.166084,-8.369735,21.998308,-5.6056643,21.052315,-8.815383,17.174576,-10.340479,17.152224,-3.4954836,14.72303,-3.9158247,13.007258,-8.6080065,12.60407,-6.84491,11.448809,0.38875896,0.32684985,18.97776801345454,5.89763973001075,0.0497555427619474,0.1657109927078789,0.203208139084739,0.04403089,5.0
audio_482.wav," Alas, my favourite place that I like to visit. I now live in the western Cape Town, which is a destination area. But I grew up in the north, which is in the Popo province, which makes it very interesting to go to the Popo. Then any place that I can visit in the world, because I have more friends there, I have family there. So when I move from the coastal town to go to the inland, it feels different to get the weather spread, but otherwise home is home. Especially when you visit in December, there's a lot of food that we eat, that we grow up eating like mopaniwens, as well as a lot of fruits, some of fruits in that area. It's...",-297.8855,110.901276,104.78943,52.48762,-7.191458,39.826176,44.453476,38.860367,-3.4145846,26.344606,-15.697929,20.445372,-1.0875874,21.793903,-16.620432,18.627747,-12.496424,17.856962,-12.381351,16.603218,0.31223541,14.901343,-1.3834895,12.026646,-7.349209,11.535892,0.33654198,0.31275272,20.83220778564857,5.878895530191289,0.0019034102615426,0.1464206418862605,0.1255689673840618,0.05508945,3.0
audio_483.wav, I'm not a dog. I'm not a dog. I'm not a dog. I'm not a dog. I'm not a dog. I'm not a dog. I'm not a dog. I'm not a dog. I'm not a dog. I'm not a dog. I'm not a dog. I'm not a dog. I'm not a dog. I'm not a dog. I'm not a dog. I'm not a dog. I'm not a dog. I'm not a dog. I'm not a dog. I'm not a dog. I'm not a dog.,-408.70203,73.60286,112.53668,61.810223,34.660595,39.61588,4.5899296,29.212177,7.6001616,21.215532,27.436003,18.82406,25.383415,20.357624,9.876501,18.730753,7.472914,13.9326515,11.89271,14.048828,9.939671,11.946694,8.9516535,10.773743,5.7131634,9.243384,0.48549366,0.2933097,19.441962773718217,7.043158793042056,0.0058375390584669,0.1047849489828363,0.0561411617366412,0.0399715,4.0
audio_484.wav," My favorite place to visit is Thailand. We went there last year. I can't seem to remember the hotel we stayed at, but it was this really nice place. It was right on the beach. And you could literally walk out the hotel and grounds and you'd literally be on the beach. There was a bunch of resorts that were along the coast of the beach. You could walk up and down it and just visit also to restaurants and places there. It was really peaceful, just really quiet. We'd sound weird for a hotel resort, but that's what it was. And the locals were really friendly there as well. And there was some really nice fresh food that you could buy from the restaurants along the beach. A lot of crabs and fishes that will be cooked fresh.",-352.83853,165.9264,69.36306,72.81265,1.6191258,30.641674,14.75792,29.430182,-11.730794,20.925545,5.398833,13.937952,-7.5002017,13.975392,-9.842129,13.349599,-10.241075,11.83737,-8.756425,13.602796,-5.1149483,8.97418,-2.00704,7.62977,-11.990235,12.32729,0.49981427,0.2930685,17.160655187625995,4.983309686087609,0.0072588524158099,0.0860541248300446,0.2477031541200745,0.031360865,5.0
audio_485.wav," My favorite place to visit, I would say, is Japan at the moment, as recently as I traveled there. It was everything that I thought it would be. Very clean. People were really nice. Amazing landscapes and amazing things to see. Getting around was really easy with the train systems. I would say that really bad thing was there. It wasn't there for enough time. We definitely want to go back. Let's more to explore and see.",-394.18433,136.02841,72.623245,73.89248,15.541219,40.29552,16.540821,33.19266,-13.825051,22.384506,-19.508944,25.029785,-9.053497,18.39643,-12.92861,17.257763,-12.888569,17.82135,-3.8704119,12.919515,-10.857727,12.676125,-3.8364758,11.054879,-8.3939705,11.004415,0.39286008,0.3292601,19.554508984374905,6.281088958522747,0.0248914438907413,0.1409672229483393,0.1724713557633354,0.04333945,4.5
audio_489.wav," Let's see. My favorite place to visit would be St. Augustine. We generally just drive there because it's a few minutes away, not a few minutes, it's a few hours away. So it's not that hard of a drive. We like to go before it gets too hot in Florida and we just walk around the main strip that has all of the boutique shops and we eat and we go to our favorite restaurant. That's right on the water and we eat as much as we can possibly stuff in our bodies. We go to the lighthouse. We walk along the beach there. It's just so beautiful and it's quiet and we just really love. It's a romantic setting. We love to eat the oysters there, the seafood, everything. Unlike I said before but we like to go before it gets too hot so we're not sweating our booties off.",-306.34253,111.44282,88.18201,55.040043,29.170723,41.066505,20.682123,32.997326,-10.547303,26.557878,7.181506,19.200718,-13.62158,18.27333,-7.0659804,13.501537,-10.402594,16.694723,-7.1114635,12.515168,-12.221737,12.164815,-22.39003,14.766414,0.2386331,13.05479,0.32229525,0.3193506,20.5798761937286,6.193238567497661,-0.007631856195734,0.1565456985436998,0.1305437341919595,0.061566442,5.0
