audio_716.wav," So, um, people are selling, um, a lot of food, different kinds of foods. It could be, it's, it's a sort of cultures market where you can find different types of food from various cultures like Latin American culture and in different countries of in the Latin American culture. German food, French food, East Asian food or just Asian food, I'm like Indian food or or",-420.0381,119.633804,63.45305,68.561455,9.334008,29.328598,7.9405627,25.709864,-1.8636162,18.636925,2.4574857,12.766285,-14.460397,17.809332,-16.204597,17.71412,-11.696546,14.58498,-10.995071,12.048714,-4.781463,8.293436,-0.4455211,7.542773,-3.2002406,6.4151335,0.38344395,0.31725347,20.176502123561427,6.343689151527922,-0.0134923511936379,0.1588035560578596,0.1299449526590788,0.03617238,4.5
audio_721.wav," It is a center of attraction for both buyers and sellers. There is no other place in the area having such brisky business as the market. I always find a big crowd date. There are usually shops or decorated beautifully. So the usually the markets are very busy and crowded. It is very difficult to buy something. It is very difficult to buy. It is very difficult to buy fruits, vegetables and we can't communicate with sellers because there are so many people and sometimes they will get confused for you to the customers because all of them will gather at one place and they will come and take a walk.",-323.29932,116.412346,81.67954,48.58976,-5.973363,40.307766,25.801592,37.44048,-5.4283495,24.910398,2.1742375,19.607481,-16.73724,18.99571,-5.328539,15.5839815,-9.100214,15.168365,-3.509317,11.927543,-7.021134,11.406717,-15.96995,14.003851,1.5831606,11.104314,0.280378,0.32368997,21.51952912048182,6.078802717246678,0.0046218756716655,0.1777360073226659,0.1155193357294994,0.058409806,3.0
audio_722.wav," And the profit is in a described scene of the crowded market, especially in a crowded market. One in times the crowd is more. And the sales people can speak the cost of their natum. Yeah.",-439.71567,146.26433,44.514416,48.325752,12.884667,19.669798,2.1691754,19.12922,-0.33305228,11.295007,-1.1480355,12.250611,-3.6916034,10.980204,-1.0918928,8.808076,-3.112819,10.425966,-2.0446582,6.8061705,-4.660981,7.3645434,-5.4224916,7.1639566,-5.5586166,6.095654,0.52421075,0.28489986,16.483121254411103,4.372501947801463,0.0063244507649005,0.1068155734345545,0.1710071177782215,0.01799008,2.0
audio_724.wav, I'm going to go to the bathroom. I'm going to go to the bathroom. I'm going to go to the bathroom. I'm going to go to the bathroom. I'm going to go to the bathroom. I'm going to go to the bathroom. I'm going to go to the bathroom. I'm going to go to the bathroom. I'm going to go to the bathroom. I'm going to go to the bathroom. I'm going to go to the bathroom. I'm going to go to the bathroom. I'm going to go to the bathroom. I'm going to go to the bathroom. I'm going to go to the bathroom. I'm going to go to the bathroom. I'm going to go to the bathroom. I'm going to go to the bathroom. I'm going to go to the bathroom. I'm going to go to the bathroom. I'm going to go to the bathroom. I'm going to go to the bathroom. I'm going to go to the bathroom. I'm going to go to the bathroom. I'm going to go to the bathroom. I'm going to go to the bathroom. I'm going to go to the bathroom. I'm going to go to the bathroom. I'm going to go to the bathroom. I'm going to go to the bathroom. I'm going to go to the bathroom. I'm going to go to the bathroom. I'm going to go to the bathroom. I'm going to go to the bathroom. I'm going to go to the bathroom. I'm going to go to the bathroom. I'm going to go to the bathroom. I'm going to go to the bathroom. I'm going to go to the bathroom. I'm going to go to the bathroom. I'm going to go to the bathroom. I'm going to go to the bathroom. I'm going to go to the bathroom. I'm going to go to the bathroom. I'm going to go to the bathroom. I'm going to go to the bathroom. I'm going to go to the bathroom. I'm going to go to the bathroom. I'm going to go to the bathroom. I'm going to go to the bathroom. I'm going to go to the bathroom. I'm going to go to the bathroom. I'm going to go to the bathroom. I'm going to go to the bathroom. I'm going to go to the bathroom. I'm going to go to the bathroom. I'm going to go to the bathroom. I'm going to go to the bathroom. I'm going to go to the bathroom. I'm going to go to the bathroom. I'm going to go to the bathroom. I'm going to go to the bathroom. I'm going to go to the bathroom. I'm going to go to the bathroom. I'm going to go to the bathroom. I'm going to go to the bathroom. I'm going to go to the bathroom. I'm going to go to the bathroom. I'm going to go to the bathroom. I'm going to go to the bathroom. I'm going to go to the bathroom. I'm going to go to the bathroom. I'm going to go to the bathroom. I'm going to go to the bathroom. I'm going to go to the bathroom. I'm going to go to the bathroom. I'm going to go to the bathroom. I'm going to go to the bathroom. I'm going to go to the bathroom. I'm going to go to the bathroom. I'm going to go to the bathroom. I'm going to go to the bathroom. I'm going to go to the bathroom. I'm going to go to the bathroom. I'm going to go to the bathroom. I'm going to go to the bathroom. I'm going to go to the bathroom. I'm going to go to the bathroom. I'm going to go to the bathroom. I'm going to go to the bathroom. I'm going to go to the bathroom. I'm putting this euh.. I'm putting this for like a weekend. I'm putting this for like a weekend. I'm putting this for like a weekend. I'm putting this for like a weekend. I'm putting this for like a weekend. I'm putting this for like a weekend.,-401.59805,69.392685,87.27765,60.731106,34.62659,40.386066,20.954662,18.825123,12.350858,16.671053,14.115332,14.240893,9.721422,14.119024,5.8357663,15.574989,11.866446,13.682552,16.24881,14.968323,10.935299,12.308752,1.7389915,11.224783,0.0275107,10.834941,0.4281491,0.30919296,20.582801749400204,7.075985865677346,-0.0072900145045485,0.1124473469663888,0.0427258662679744,0.033528727,2.0
audio_725.wav," Okay, so standing right in the middle of the market and looking to my left, I might see the women selling vegetables. I could actually see some selling fruits, I could see some selling fruits. Banana, pineapple, and also some selling plantain. So far to the far right, I could see displays of different spices to use to make food, different spices. And then sounds around the market place, sounds of chance people talking to, calling out for to market their food and then sounds of vehicles to passing by and then it's just all across the street.",-358.7894,89.22018,76.03944,64.40856,34.58605,37.46484,8.931563,23.81237,3.7662463,18.71746,3.6900322,19.722536,-7.3944707,16.271755,-21.88242,17.697947,-5.424576,14.308989,-10.077655,12.514608,-7.9135833,10.220023,-4.5300045,12.503789,-10.6837015,9.883621,0.36579672,0.3227252,18.843932985216025,5.299430458032901,-0.0022955130516554,0.1311067912366351,0.1852231741713259,0.038377017,3.0
audio_727.wav," Today, when I was in market, I have seen so much crowd in the market. Many people ceiling so many vegetables, fruits and many more things like fishes and other important household things and some are the customers among that crowd that are buying all these stalls. All the sounds are so creepy that it disturbs my peace. The crowd actually is very much irritating because of all the boys around the market. And whole day it is the same from morning to evening. The rush is increasing. Time by time. And it is creating very much rush and the crowd is just disgusting. The moment you take some action.",-333.92276,120.892845,76.19979,52.261242,9.958868,45.931137,23.066927,34.68991,-16.061918,31.13503,-6.8268647,22.471035,-1.3498695,17.555601,5.557744,16.095503,-10.933575,18.28288,-9.099522,13.089462,-2.6965523,11.2835655,-13.55496,14.59549,-0.803092,12.243473,0.29717663,0.32341677,21.092419570282985,5.942239888041133,0.01685279178053,0.1436171715903894,0.1372182112786208,0.050469972,2.0
audio_730.wav," The scene of a crowded market. The crowded market was a bustling hive of activity. And a kaleidoscope of colors, sound and smells swirling around me. Vendors called out their wares in a cacofony of voices, wild shoppers weave through the narrow pathways. Their arms laden with bags and baskets. The air was thick with the aroma of spices. Freshly baked bread and exotic fruits creating an intoxicating sensory experience. Despite the chaos, there was a sense of vibrant energy and camaraderie among the diverse array of people navigating the market, each with their own purpose and destination. The crowded market.",-319.91614,146.69095,58.72094,55.18076,20.182844,41.674915,17.223349,29.1225,-7.4516215,24.549223,3.1012664,16.76601,-7.415086,15.362019,-2.180776,13.455927,-2.2464318,11.795335,-4.254805,10.662555,-2.1087213,8.31307,-6.8285055,10.020885,-3.075146,9.041894,0.31542462,0.3268903,18.26979115196502,5.094183098688888,-0.0013935551202038,0.1651879585647599,0.1428916858027156,0.053051487,4.0
audio_731.wav, 1.0.1.1.1.1.1.1.1.1.1.1.1.1.1.1.1.1.1.1.1.1.1.1.1.1.1.1.1.1.1.1.1.1.1.1.1.1.1.1.1.1.1.1.1.1.1.1.1.1.1.1.1.1.1.1.1.1.1.1.1.1.1.1.1.1.1.1.1.1.1.1.1.1.1.1.1.1.1.1.1.1.1.1.1.1.1.1.1.1.1.1.1.1.1.1.1.1.1.1.1.1.1.1.1.1.1.1.1.1.1.1 Messer 4 is Best Leveling on shoulders. Funnels 2 is attempting to look straight under an arrow we decide to film on the visual. We first Seg skef it on the tensilewind to bend down the upper end. 1.0-1-1-1-1-1-1-1-1-1-1-1-1-1-1-1-1-1-1-1-1-1-1-1-1-1-1-1-1-1-1-1-1-1-1-1-1-1-1-1-1-1-1-1-1-1-1-1-1-1-1-1-1-1-1-1-1-1-1-1-1-1-1-1-1-1-1-1-1-1-1-1-1-1-1-1-1-1-1-1-1-1-1-1-1-1-1-1-1-1-1-1-1-1-1-1-1-1-1-1-1-1-1-1-1-1-1-1-1-1-1 2-3-2-1-1 7-2-1-1-1-1-1-1-1-1-1-1-1-1-1-1-1-1-1-1-1-1-1-1-1-1 1.5% 1.5% 1.5% 1.5% 1.5% 1.5% 1.5%,-544.5994,100.3716,54.199196,80.247734,3.5015793,35.131096,-4.347483,19.506641,6.391558,14.869141,16.525097,25.05831,6.4391837,19.572666,3.88179,13.844831,7.933217,13.903735,8.896093,14.772593,4.5805717,11.235152,0.12108937,9.233268,-0.34342107,9.222638,0.5446938,0.30344388,17.9204279196108,6.093329719234161,0.0149289275667365,0.1161318991809521,0.1872150753650364,0.01663795,4.0
audio_736.wav," A marketplace is a very busy place where people go to buy articles on their needs. It is a centre of attraction for both the people and whenever I visit a market I find the hawkers shouting loudly to sell their goods. They try to attract the people by several names. Generally they sing songs in the price of their goods. They freeze hot competition because they are several hawkers selling the same article. As the prices of the items are not fixed, the hawkers are as well as the buyers go to do bar game. I watch these people who feel greatly satisfied of the purchasing the things at the minimum price from the hawkers. And they don't...",-296.57727,99.7563,71.05755,42.143913,8.353205,41.056934,12.91258,36.024357,-14.366085,26.427038,-5.9383864,24.130798,-14.512573,19.532856,-6.4202194,18.008757,1.731346,15.32546,-23.283014,18.051193,-4.969525,12.047266,0.35368317,12.184374,-7.69527,9.889431,0.29265076,0.33443436,21.582278090250007,7.17365869975565,0.0040885364631832,0.1674578802266731,0.1576930036940894,0.06186078,3.0
audio_74.wav," Describing a scene of a crowded marker. So the crowded marker is very busy. Busy and hustle. People everywhere, very, very hard. I can imagine lots of sweaty armpits, sweaty shirts, back, just lots of noise. People walking in and out of different stores, looking at items, buying, selling, produce, and artifacts, et cetera. And the market is very noisy. Lots of people talking, yelling on top of each other. We have hagglers, no hagglers. Barters trying to get a better price. And the market generally starts out very, very quiet in the mornings with only shopkeepers filling up their stores to throughout the day, getting busier and busier and eventually before night falls. The market quietens down.",-282.53854,130.46274,82.751015,74.45997,-2.8178718,46.77506,36.524113,34.677715,-17.94827,29.279648,10.147491,23.199572,-11.226277,23.572544,-3.0844824,19.030247,-2.6207032,13.189035,2.9351487,12.149571,-2.1766734,11.64905,-3.6507547,9.4941,-1.134929,7.8240585,0.40003616,0.31253088,18.74257007872145,5.356978027000153,-0.0061267318953142,0.1522251434049534,0.1552240373735356,0.057811774,5.0
audio_743.wav," My favorite hobby is cricket. I like every move. I like to play cricket with my friends and with my friends only. I use to play cricket in my childhood days when it is about 10 standard, up to 10 standard only. Nowadays I didn't want it to be brown to play cricket because all my friends are very busy with their academics and all other teams. And I enjoy very much to play because it has very ups and downs in the cricket and very happiness and sadness with my friends and all other things. Is it a dream? Is the good play? We use that and ball and the cricket and all other things. Mainly we use ball of bat and ball and we enjoy to practice cricket very honestly and we learn the cricket by watching the cricket only. I like the cricket very most.",-334.49387,131.0593,76.90845,60.85961,5.750242,40.000633,39.227245,46.81465,-10.778099,27.146143,-15.507742,22.365095,-8.2387,17.300707,-17.038553,17.737394,-10.052473,15.7300005,-20.513077,21.102543,2.3751109,10.289313,-7.259431,9.822617,-14.871107,13.409765,0.3937868,0.33890218,20.92128675662604,7.534135404569983,0.0220595880668941,0.137361987319545,0.1221628727369542,0.05432437,2.5
audio_744.wav," My favourite hobby is drawing and I love to draw the pictures and I enjoyed the lot when I was drawing and I used some tools to draw and tools are like pencil, eraser, scale and colors and something like cotton to wrap the colors and while I'm drawing a new picture I'll involve very deep and I'll draw and I love to draw the pictures and I like to enjoy the practicing my own hobby that is drawing with a",-341.30328,118.14239,90.8155,56.818592,-10.723334,39.636448,16.851276,30.248158,-16.289648,19.775675,-14.240388,16.811377,-5.802403,16.025753,-10.020519,15.725328,-5.10479,12.1787,-8.506883,12.746779,-8.163862,10.908135,-4.01996,10.950046,-10.516597,10.704405,0.28291345,0.32500306,19.309057888503265,5.710150303445524,0.0273178238384805,0.1790832137332041,0.113498610556443,0.04901145,2.5
audio_745.wav," I'm going to go to the other side. I'm going to go to the other side. I'm going to go to the other side. I'm going to go to the other side. I'm going to go to the other side. I'm going to go to the other side. I'm going to go to the other side. I'm going to go to the other side. I'm going to go to the other side. I'm going to go to the other side. I'm going to go to the other side. I'm going to go to the other side. I'm going to go to the other side. I'm going to go to the other side. I'm going to go to the other side... I'm going to go to the other side, I'm going to go to the other side, I'm going to go to the other side, I'm going to go to the other side... ...and go to the other side that's... ...a strangeoooarzag... I'm going to go out and try... I'm going to go to the other side... ...and go to the other side... I'm going to go out and try. I'm going to go to the other side, and go... I'm not going to be able to do it. I'm not going to be able to do it. I'm not going to be able to do it. I'm not going to be able to do it. I'm not going to be able to do it. I'm not going to be able to do it. I'm not going to be able to do it. I'm not going to be able to do it. I'm not going to be able to do it. I'm not going to be able to do it. I'm not going to be able to do it. I'm not going to be able to do it. I'm not going to be able to do it. I'm not going to be able to do it. I'm not going to be able to do it. I'm not going to be able to do it. I'm not going to be able to do it. I'm not going to be able to do it. I'm not going to be able to do it. I'm not going to be able to do it. I'm not going to be able to do it. I'm not going to be able to do it. I'm not going to be able to do it. I'm not going to be able to do it. I'm not going to be able to do it. I'm not going to be able to do it. I'm not going to be able to do it. I'm not going to be able to do it. I'm not going to be able to do it. I'm not going to be able to do it. I'm not going to be able to do it. I'm not going to be able to do it. I'm not going to be able to do it. I'm not going to be able to do it. I'm not going to be able to do it. I'm not going to be able to do it. I'm not going to be able to do it. I'm not going to be able to do it. I'm not going to be able to do it. I'm not going to be able to do it. I'm not going to be able to do it. I'm not going to be able to do it. I'm not going to be able to do it. I'm not going to be able to do it. I'm not going to be able to do it. I'm not going to be able to do it. I'm not going to be able to do it. I'm not going to be able to do it. I'm not going to be able to do it. I'm not going to be able to do it. I'm not going to be able to do it. I'm not going to be able to do it. I'm not going to be able to do it. I'm not going to be able to do it. I'm not going to be able to do it. I'm not going to be able to do it. I'm not going to be able to do it.",-453.9068,71.56042,84.26194,65.89091,30.080647,46.260582,19.819572,29.794458,28.66425,22.234268,21.13615,18.920485,9.1913595,20.47453,8.071952,17.600914,10.441749,16.72085,9.306937,16.065935,3.454901,13.187263,-2.7735498,11.59381,-4.716232,10.50669,0.3981379,0.31932992,20.33424967010954,6.933253505922885,-0.0051959850798039,0.1308038320726965,0.0602339519905023,0.036236394,5.0
audio_748.wav," My hobby is to do basically amacaracanac music. I have started learning to sing from my childhood. I like singing, I love singing, I enjoy singing very much. And during my singing journey, I will go to a temple yard my home. Where they will perform bhajins. Every Saturday I go and sing there. All the songs I know related to the temple. The God in that temple. And I enjoy singing very much. There will be so many people singing along with me. I like to sing alone as well as sing with others. So I have participated in many groups songs and etc.",-295.70468,73.32727,111.26602,39.095894,-11.093426,26.23882,32.847713,21.867552,-7.0072975,17.432785,2.3228226,15.028155,-1.1059073,12.078676,-11.61526,14.171171,0.37469828,10.878192,-9.505354,10.178084,-7.200573,9.661768,-2.4978456,8.447339,-6.50435,7.886987,0.38028377,0.33677742,18.763588721912733,5.879590492738236,-0.0032627423990297,0.1541255993552099,0.1098905813198881,0.05562945,2.0
audio_753.wav," My favorite hobby is reading. Hello, getting lost in your book, good book, and escaping into different worlds, characters, and old stories. Reading has me to relax and we know for a long day. It also has me to know about new things and expand the horizon of my knowledge. It also has me to learn vocabulary in it. I also enjoy writing. I often find myself short-hink down ideas for stories or poems in my spare time. Writing allows me to express my creativity and explore different ideas and perspectives. Also my hobby is to listen songs which makes me relaxed and stress-free. Overall my favorite hobby is one that allows me to engage my mind and explore my interest and passion, whether it's reading or writing or not.",-334.91434,129.71474,53.409645,51.052185,-13.490563,34.991474,15.597106,30.76494,-22.820545,29.002523,0.18317619,16.624344,-16.191576,16.96122,-12.087479,14.911293,-9.551456,14.6473675,-6.5796027,10.451629,-6.828272,9.883924,-10.940996,10.833464,-4.898747,9.2866125,0.33103228,0.34909117,20.02851116799409,6.520613199552688,-0.0038672105366368,0.1577073340886188,0.1464703349640575,0.04931135,4.0
audio_755.wav, My favorite hobby is about playing shettling with one of the most enjoyable hobbies and I used to play every day with shettling and I enjoy practicing with my own and it also my friends because it makes me more and more competitive day by day and it increases the sportier skills and healthy fit towards my mental and physical happiness and it makes me fit and I enjoy playing shettling every day and yes of course I practice the hobby with help of my friends and one of my friends suggested me this when I was a fire school and from,-314.76224,84.1916,85.647896,40.337265,28.586412,33.315487,16.713236,31.872166,-27.39055,27.738073,-10.982771,19.63759,-23.091629,20.008415,-8.547334,14.4217825,-12.404367,15.181361,-5.332128,12.744675,-4.361754,12.040612,-11.9411545,14.154207,-2.6154563,13.22873,0.29670385,0.33310556,19.95914976528904,6.419677127263099,0.0089478056069671,0.1723551735163516,0.1365268695087859,0.07839802,3.0
audio_758.wav," Oh, I would have to say my favorite hobby is Dungeons & Dragons. It's very nice to play with other people. Though any limitations are really your imagination. In a kitchen table, maybe some snacks. Four or five friends together, place some adventures, some dyes. It's a very imaginative, thought-attent, extensive game. Which is great. And it's fun for all ages. It does get a bad rap because they liked it with Satanism. I think Satan has anything in it. It was a D6 or a D12 or a D20. It's just, you know, Christians get, they just leave everything evil. So it makes them more exclusive to their cool, like D&D is just a five-board game they can play. And that's the last game.",-308.69928,116.894066,92.149864,78.97997,-41.145294,39.589813,15.81862,38.423557,2.9471776,24.043098,-10.060902,25.766727,-9.518238,20.178707,-2.7025259,16.7288,-2.0000644,16.934706,2.7069218,14.80845,-16.439636,13.08608,1.2010428,12.811318,2.9112031,11.635836,0.4156038,0.30124107,18.776686296213512,5.390914374394335,-0.0042167646351176,0.0935297941768409,0.1896108533781983,0.030781923,5.0
audio_76.wav," Had N interior designer ond van hadnapangan, kn вокised style imaginatory. It's a simple product space deal. What I don't understand here is the same as a digital one, Gazner d** Wa'eng g**n Gar*** Bayhguah Inkhaelantmenikkenikken. Para para para shake ngOME",-354.0984,110.19879,70.66812,68.7468,30.728825,37.48532,13.111898,29.437168,8.341341,26.803854,0.95916915,17.241718,-5.0674734,15.96446,-14.175746,16.795961,-12.444205,16.718035,-14.32008,15.958672,-2.9742672,13.2299185,-1.4645853,12.699456,-5.7539105,11.697033,0.32994077,0.31637707,20.493443964508284,5.707778073122976,0.0102378932901723,0.1426304035180132,0.1716815595047923,0.044579573,2.5
audio_760.wav," I am going to tell about my hobby. And my hobby generally hobby is considered a regular activity that is done for enjoyment during leisure time. Hobby include themed items and objects, engaging in creative and artistic, push-wet, playing sports or doing really creative things or participating in any of the activities. I generally interested in reading books or developing fashion making it diverse and different from others. I always tend to follow trends in society and also advancing production and technology of this generation. Thank you.",-283.0615,115.47387,95.13132,50.688522,11.898433,34.175594,13.85961,28.141737,-4.0223026,21.546848,-11.300367,22.306496,-8.508533,16.682852,-9.184476,15.697883,-9.536202,14.261843,-15.217633,15.046328,-2.023782,11.535557,-4.4115186,11.494601,-5.4782457,10.051328,0.32565388,0.3242482,18.847057015255093,5.197488994345969,-0.0004152945301129,0.1403428094992051,0.1312168759152023,0.076680794,2.0
audio_763.wav," Yes, my hobby is to play with my friends and colleagues and other people who are there in the ground. So, when I am playing, in case my self is feeling very happy and feels very peaceful mind and the body is under situation is very comfortable. There are only two players playing cricket like a bat ball and some tools on it. So, that is why I need to enjoy with that people. Yes, of course I enjoy when I play with my colleagues friends. I enjoy a lot because of everybody having different thoughts and different thoughts. So, different studies in the world.",-310.7031,66.026405,141.71269,52.756775,-10.190963,24.399845,4.427008,28.468908,13.407146,21.364477,-13.056093,16.152641,-15.41013,18.55528,-2.247789,14.036102,-11.709451,13.010883,-5.710793,15.950002,1.155633,13.076085,-2.6055434,10.985423,-0.55103034,10.059774,0.3122074,0.3189479,19.867669420880247,5.297553409354833,-0.0088636781024122,0.1485061976323859,0.1136221108726038,0.059958175,2.5
audio_765.wav," Makiwaratobi is watching football. I like watching football a lot because it gives me the thrill and passion. I enjoy football, football, football and life. There's not like I don't do to watch my team play. I go to the stadium every weekend when football season is on. I virtually live from football. I come with for my team some winter. I can't true my friends, my friends, the losing team. I mainly practice football. I play football with my friends. I play football a lot. It's my favorite of the, and I can't do it football. And the morning when I give my song or talk. It's virtually going to play football. Football is life. I enjoy doing it. I enjoy truly people. Football is such a beautiful game.",-302.3334,81.16543,104.03628,44.30303,5.5835514,26.301365,24.87275,26.612885,14.079712,19.690495,0.67734045,14.317352,-10.172738,16.90732,2.6466408,12.434258,-4.1431737,12.65139,-17.633968,16.510185,-7.7667356,12.1994505,-3.4610896,10.104533,-10.8509445,11.108996,0.3404759,0.32669842,19.613433030639623,5.627321910869273,0.0326275213782763,0.1448007662355234,0.1167213188065761,0.06233862,3.0
