filename,transcript,mfcc_1_mean,mfcc_1_std,mfcc_2_mean,mfcc_2_std,mfcc_3_mean,mfcc_3_std,mfcc_4_mean,mfcc_4_std,mfcc_5_mean,mfcc_5_std,mfcc_6_mean,mfcc_6_std,mfcc_7_mean,mfcc_7_std,mfcc_8_mean,mfcc_8_std,mfcc_9_mean,mfcc_9_std,mfcc_10_mean,mfcc_10_std,mfcc_11_mean,mfcc_11_std,mfcc_12_mean,mfcc_12_std,mfcc_13_mean,mfcc_13_std,chroma_mean,chroma_std,contrast_mean,contrast_std,tonnetz_mean,tonnetz_std,zcr_mean,rmse_mean,grammar
audio_1008.wav," The school playground is lively and filled with colorful equipment like swings and slides. Children engage in various games like dodgeball, soccer. It's normally filled with laughter and laughter in the air. It's normally accompanied with sounds of swings, squeaking and balls bouncing. The dynamic environment, we have friendship, our form and memories I meet. It does experiences from school playground and seems you could find on school playground.",-438.01587,137.87389,36.447296,69.35886,3.821594,26.377298,18.46732,31.589945,-2.2132092,17.059267,-6.342358,18.50062,-6.20841,14.519715,-2.3893833,9.4997425,-7.6932783,12.235136,-1.1465358,9.505446,-11.052747,13.333594,-3.3442242,8.601461,-8.887612,10.98734,0.48196033,0.31904382,17.92463314692258,6.469321211705712,-0.0024434184278218,0.1327070954467038,0.1587806815531716,0.022747593,4.0
audio_1017.wav," In the school playground, the mitesand catch a warm glow over the vibrant scene below. Children of all ages fill the space, their layoff and the shorter and green, against the walls of the surrounding buildings. The playground is divided into sections, each blushing with different activities. There, the streets, a group of young children take the stones of pushing each other higher and higher into the sky. There, we can float in the trees, meanwhile on the basketball court, and intense games underway. With students dribbling, passing and shooting with the determination shared on by their classmates lining the side-lights. In a quieted corner, a few students sit in the shade of the large street, and in overboot.",-320.42764,70.83842,123.34535,25.811644,-19.073486,26.396626,23.020292,28.831673,0.40779603,18.624289,-4.344967,22.55521,-4.5094457,17.264265,-3.0281773,13.398233,-6.1908727,13.568348,-7.5011654,13.08524,1.9589206,12.558895,0.2900549,10.369803,0.2589363,9.1310835,0.4397367,0.31763956,17.640193161084802,5.175990210665328,0.0057844096424846,0.087129655230679,0.1010110385882587,0.033986695,4.0
audio_102.wav," At the market, there is a lot of people selling there, there is a lot of stores and there is a lot of people that are selling and customers as well. They are selling fruits, they are selling handmade crafted things which are really interesting especially if you are into art and you also like more authentic things. So what sounds do you really get from the market? It's types of music because you also get a lot of talented people there who are performing and you get to hear music, you get to hear drums, you get to hear all kinds of things and sometimes you also hear some people screaming, some people shouting, some people are also applauding and clipping their hands and you also get to be exposed to different sounds. And with the types of crowd, it's a bit more overwhelming because there's a lot of people, there's a lot of noise but overall it's not.",-317.47037,92.64218,96.71045,71.87279,9.292677,52.59644,30.722073,41.2785,-4.145835,29.657938,-30.519575,25.715971,-8.914343,21.40825,-5.4011645,18.559155,-1.3557719,15.14761,-4.9499097,11.971315,-9.050469,11.20898,1.8540913,10.8309355,-5.460269,9.689158,0.33059773,0.32042223,20.39643018506016,5.743894294802101,-0.0061209885481664,0.1319875276956023,0.1469599162173855,0.0540774,5.0
audio_1024.wav," My favorite place is in Andhra Pradesh. It is in Chetodistic. It is the temple of Lord Ventechwara Swami. It has seven hills to visit the temple. It is a good place to receive the Tirumala. For India here, crowds of people to visit the Lord Ventechwara Swami, in Tirumala, have a lot of places to visit the tourist. In Tirumala, Ladwizha is the famous.",-395.97574,152.25404,83.70689,68.29327,-9.338621,32.15485,22.242302,30.071775,2.223831,15.708841,-4.6401095,15.835111,0.9915089,12.022875,-5.5420604,12.895237,-6.2530794,15.315412,-0.23180607,11.292574,-7.6159215,10.642625,-4.440738,8.68729,-7.586988,9.001675,0.3745079,0.3102694,18.566815765773654,5.416390415302195,0.0061014457251054,0.1276734655949775,0.0946631223375931,0.04144122,1.5
audio_1025.wav," I would like to go the Sachi for the Sachi's Tup is a very famous place in the MP and there a local food will be a good, a very best food like a Pao Aji in the latest it is like a sandwich and a Maima sandwich is the famous food of the Sachi and this is made by a Samrat Ashok they are the powerful emperor of the India he becomes its empire becomes over all the Indian after the India he will be established our empire through defeat the many kings and he after that he made us to call the Sachi's Tup for Buddha's it established in the Sachi and he after that he made us to call the Sachi's Tup for Buddha's it established in the Sachi and he after that he made us to call the Sachi's Tup for Buddha's it established in the Sachi",-316.61896,123.16568,65.66385,53.354553,3.2395918,38.500397,33.875946,41.262375,-13.334555,25.49616,-3.8209093,18.731848,4.3957915,17.66237,-16.391735,18.594526,-4.985112,12.909777,-8.285057,15.522623,-9.492434,11.439361,3.2932525,9.425318,-7.728069,11.946363,0.34740716,0.3225388,20.310790121654907,6.41986875180175,0.0075350918770861,0.1384391250799058,0.1366688470420597,0.05173715,2.0
audio_1028.wav," My favorite place to visit, Karla, it's so beautiful with greenery and board traveling. And there are many famous places like Wainaud, some more like the full of greenery and nature, peaceful mind. There were many foods they prepared with coconut and the duration was so good. And like I like to travel more like Karla's and Himalayas and much more like places to enjoy myself to take my time to myself to around explore by me.",-330.60388,82.345856,80.43314,47.479305,-8.584592,32.67319,4.5224457,22.100885,-9.695792,17.13865,-3.8969774,15.2164545,-11.934242,18.649647,-12.606226,17.370117,-4.863219,12.19159,-8.141374,9.679276,-7.895649,9.457404,-4.149752,8.431007,-1.2894598,8.37098,0.3657069,0.3329276,18.58177249790267,5.762233618607402,0.0016448653213357,0.1620994316469543,0.1753987890208999,0.040161647,2.0
audio_1030.wav," My favorite place is St. Colha Hospital. The genuine archival experience is very good. And that place is where we can never forget that food is those. That place is very delicious. And we also can sit inside me. And also we can eat together in particular time of day or season. When this place is specially magical or beautiful, but night time we will go that place.",-306.64456,57.367603,120.65512,26.771238,-6.372949,15.455059,17.854725,27.601044,-10.723031,17.384508,-9.463614,12.261487,-1.4823884,13.133493,-4.4414344,12.894343,-2.70484,11.137789,-10.364808,11.759841,-7.810784,9.273787,-11.845293,9.359079,-2.820051,8.265135,0.37163073,0.3211413,18.628142225735846,5.111032470213847,-0.0118511406952988,0.1283463554895232,0.0932331186767838,0.04540056,2.0
audio_1031.wav," I would like to visit South Korea because I really love the place to visit once in my life and I would like to travel to Erupe because that would be my first experience. I would like to taste the local dishes in South Korea, kimchi, jjampong, sushi and many other dishes by spicy dishes. I would like to visit the country in autumn season because the flowers or the tree blossoms, cherry blossoms.",-331.6061,73.46141,94.89172,40.668056,13.860718,30.965052,33.591072,28.846395,5.968874,23.159086,12.48451,17.191547,0.71933603,19.292809,1.8527251,15.445885,11.375326,14.243767,7.84123,11.989527,-5.598087,11.577119,-1.3190151,9.798619,0.8888031,9.118999,0.3682685,0.32462806,18.99233573450024,5.840031813038992,-0.0075630955543625,0.1077748948605145,0.1266993643503727,0.03364254,2.5
audio_1032.wav, My favorite place to visit is Shinagar because it was in the top of the North India. My journey could be like this. I am going by train to Jammu after that we are going to have a car by which we eat Shinagar. We are able to see the national beauty of the Jammu and Kashmir which is very excited to see its looks like a heaven. The local food which is famous in that place was Rajmachawal during the road trip and there are mushrooms as well which is special. The favorite season or particular time in which we are able to go to Shinagar was in winters when the snowfall is going to begin because it looks very beautiful in the night.,-287.85052,118.0324,95.29919,63.749146,-20.81727,41.600067,38.008686,36.526012,-16.267508,26.994898,-12.149887,19.571932,-7.013177,18.21417,-17.3433,17.842724,-10.399071,13.655551,-11.892649,15.155894,-8.975114,11.957262,-14.200369,12.127339,-5.3765416,12.4043045,0.32347685,0.31335464,20.98789363592912,5.916125939069055,-0.0152042164658844,0.152265632469519,0.1352068461295261,0.058869414,3.0
audio_1036.wav," My favorite place to visit is La Basna, that is Laal Bhakhadur Saskin, Nishda Lakadmiya for the institution, which is situated in Musari. This is my favorite place because the civil servants who cleared UPSC may be attending the La Basna. This is the place where civil servants, which is the aspirants who cleared IAS, they will be training in that academy. That is the favorite place not only for me for the candidates who practice civil services and it is situated in Musari and it is the best place for the IAS offices. Moreover, the best season to visit Musari is summer season, winter season because the bus is located near to Himalayas where it is covered with snow. It is having a plenty of...",-289.5748,87.75308,67.201454,34.132046,-2.8617828,33.188324,-1.0060011,26.863012,-21.17475,26.055305,-23.535173,22.355885,-16.225683,17.066687,-3.7169135,17.657043,-4.27341,14.057752,-3.1102662,13.171991,-6.3419538,12.153759,-0.9693938,11.07861,-6.951269,12.053845,0.28754327,0.31588614,19.91553492975264,5.871518233279306,0.0057162700918931,0.1167848838673815,0.1733141036841054,0.046522174,2.5
audio_1038.wav," My favorite place to visit is beaches. This is the place with crystal-prayer waters of sand and gentle ocean raises the combination of natural and beauty relaxation. So, these sounds of waves make it a favorite place for me. It makes the favorite place for me. Meatures of a rhythm of waves, waves and beneath your feet and breathing sounds. It seeks both adventure and relaxation.",-353.76483,95.34279,82.62319,43.91295,-4.621985,24.740088,9.057306,29.94528,-1.377931,19.501554,-7.573408,14.811646,-10.189685,15.073006,-4.326474,13.464762,4.3335147,12.005355,-6.4256206,15.2109165,1.1947224,10.932104,-2.806805,11.049322,-7.809669,8.922506,0.4477273,0.31988338,17.6467056423198,5.186106469907304,0.0110123857735778,0.0919228658835669,0.1559405992079339,0.029416371,3.0
audio_104.wav," a sh- a sh- a sh- a sh- a sh- a sh- a sh- a sh- a sh- a sh- a sh- a sh- a sh- a sh- a sh- a sh- a sh- a sh- a sh- a sh- a sh- a sh- a sh- a sh- a sh- a sh- a sh- a sh- a sh- a sh- a sh- a sh- a sh- a sh- a sh- a sh- a sh- a sh- a sh- a sh- a sh- a sh- a sh- a sh- a sh- a sh- a sh- a sh- a sh- a sh- a sh- a sh- a sh- a sh- a sh- a sh- a sh- a sh- a sh- a sh- a sh- a sh- a sh- a sh- a sh- a sh- a sh- a sh- a sh- a sh- a sh- a sh- a sh- a sh- a sh- a sh- a sh- a sh- a sh- a sh- a sh- a sh- a sh- a sh- …a her natural set, from the toward her away from the dripping strength …",-391.20746,91.36613,102.18869,76.68983,23.189034,48.07554,10.220511,32.692757,-6.350909,24.069607,2.2122645,20.837084,4.8533163,22.511578,11.842923,22.153486,17.37977,18.319263,11.355174,15.60781,2.5044258,13.975705,-3.2530055,13.973273,-2.4303653,13.865763,0.3647944,0.31633896,23.25860046985839,8.881315222702943,0.0235243214604961,0.1589797745559973,0.0719064041774506,0.04961909,5.0
audio_1040.wav," In India, my fair place is Goa. In every year, I must visit Goa every summer. I am allowed to travel in train and bus. But previous year I travel in flight. That experience is very good for me and very low time to reach Goa. And I enjoy a lot with my friends. In the Goa, some foods are cost and some foods are good. But I like the very much Goa and fish tali. That food is very awesome. And some hotels that food is very cheap and some hotels is very high cost. I think it's time to visit for Goa is summer.",-350.6261,159.34323,68.67735,57.70339,-2.4268892,42.329826,28.748749,33.40696,4.336291,20.18963,-0.34104502,21.4731,12.69249,22.97168,-25.138166,24.621284,-8.277676,13.288203,0.4159504,12.656646,-16.88857,14.62628,-4.792444,12.305308,-3.3335252,10.037995,0.39568058,0.30833977,19.68606819703607,6.214461259375579,0.0251405906921533,0.1479752969110417,0.1664136860190362,0.04093817,3.0
audio_1043.wav," My favorite place to visit is Tirupati. So it has most wild traveling to this place. There are many places to see that it mostly consists about the beautiful nature and in this place many countries and many religions are combined there. The most food I like in these places that food which is given in the temple. In the rainy season, if this place was most beautiful because in the rainy season most of the plants will grow and the nature looks like very beautiful.",-323.1991,121.378,71.1448,44.53565,-2.9832618,33.883694,11.464638,25.93299,-21.259218,29.07203,-15.672798,21.19838,-14.410326,17.553923,6.5364423,15.479641,-11.075114,14.4629345,-7.3250637,11.072863,-12.339868,11.373812,-4.325776,11.806049,-6.444801,9.687857,0.24996068,0.31404343,21.198146875469053,6.079560814677317,-0.0215226205868475,0.158881908999471,0.1214959710296858,0.0559834,3.0
audio_105.wav, I'm in a public market in the Philippines and a lot of people are selling fruits like mangoes and coconuts and the landan and other fruits and also a lot of people are selling vegetables that will be used for Filipino dishes like synagogue and Pinakpet and others. There's a lot of people in the market because tomorrow is a special day in the Philippines. Tomorrow is Christmas so a lot of people are preparing to cook for the special meals for the Christmas nachibuna. At night the market transforms to eating hot spot.,-336.98004,109.89326,47.303623,72.07789,13.22667,33.549484,11.812233,24.836184,0.3462928,17.604218,3.493527,15.909557,-2.909808,15.243111,-4.1370807,15.160913,-2.5413306,12.665177,-13.179548,14.554088,-4.663085,10.992067,5.639046,11.66826,-1.8609474,9.5956,0.36701798,0.32499045,18.778481654028138,5.9000822400321296,-0.0077813446222997,0.1447534257694525,0.1791243385583067,0.041401714,4.5
audio_1057.wav," May travel journey experience destination is in Tagaytay. Some of it is very cool and very special place to me. I like the food, local food bulalo. And the dish is so very good. The taste is good. The place is very good. The particular time and they ice-pand the sani-dice because it's a... sani-dice to enjoy walking around and see the view.",-433.7086,154.63452,27.37399,46.112083,-0.07091447,31.95436,24.250225,38.20125,-12.62412,24.685165,3.7920034,12.970101,-10.256142,18.99855,-11.394642,17.09748,-8.259443,13.503858,-6.4474154,12.164998,-6.913482,10.523668,-5.848956,11.243598,-0.19723517,7.5238657,0.2393913,0.33403203,18.41251678966223,6.122786832403166,0.0003702120404383,0.1478514428616647,0.0877785647131256,0.025646117,2.0
audio_1059.wav," � patients old Halt at sreba, washe duanshe, tisu, nukat, tisu, tjap, halt at sreba, washe duanshe, tjap, halt at sreba, washe duanshe, tjap, halt at sreba, washe duanshe, tjap, halt at sreba, washe duanshe, tjap, halt at sreba, washe duanshe, tjap, halt at sreba, washe duanshe, tjap, halt at sreba, washe duanshe, tjap, halt at sreba, washe duanshe, tjap, halt at sreba, washe duanshe, tjap, halt at sreba, washe duanshe, tjap, halt at sreba, washe duanshe, tjap, halt at sreba, sreba, washe duanshe, tjap, halt at sreba. Kvalllaht, halt at sreba, washe duanshe, tjap, halt at sreba, washe duanshe, tjap, halt at sreba, sereba, washe duanshe, tjap, halt at sreba, washe duanshe, tjap, halt at sreba, washe duanshe, tjap, halt at sreba, burstowarbershe, obert 有 assets, wo Bart Garsong swar, woblepine cash, woblepine cash, wo mensurrais o winterleben r買, wo moneylaur, butexhales, woe씨, wo iyi descarhoyort, wo woeclapping kut bitterbaオr in fu, beholdswee bei Halt, halt, halt, halt, halt, halt, halt, halt, halt, halt, halt, halt, halt, halt, halt, halt, halt, halt, halt, halt, halt, halt, halt, halt, halt, halt, halt, halt, halt, halt, halt, halt, halt, halt, halt, halt, halt, halt, halt, halt, halt, halt, halt, halt, halt, halt, halt, halt, halt, halt, halt, halt, halt, halt, halt, halt, halt, halt, halt, halt, halt, halt, halt, halt, halt, halt, halt, halt, halt, halt, halt, halt, halt, halt, h halt, halt, halt, halt, halt, halt, halt, halt, halt, halt, halt, halt, halt, halt, halt, halt, halt, halt, halt, halt, halt, halt, halt N-N-N-N-N-N-N-N-N-N-N-N-N-N-N-N-N-N-N-N-N-N-N-N-N-N-N-N-N-N-N-N-N-N-N-N-N-N-N-N-N-N-N-N-N-N-N-N-N-N-N-N-N-N-N-N-N-N-N-N-N-N-N-N-N-N-N-N-N-N-N-N-N-N-N-N-N-N-N-N-N-N-N-N-N-N-N-N-N-N-N-N-N-N-N-N-N-N-N-N-N-N-N-N-N-N-N-N-N-N-N-N N-N-N-N-N-N-N-N-N-N-N-N-N-N-N-N-N-N-N-N-N-N-N-N-N-N-N-N-N-N-N-N-N-N-N-N-N-N-N-N-N-N-N-N-N-N-N-N-N-N-N-N-N-N-N-N-N-N-N-N-N-N-N-N-N-N-N-N-N-N-N-N-N-N-N-N-N-N-N-N-N-N-N-N-N-N-N-N-N-N-N-N-N-N-N-N-N-N-N-N-N-N-N-N-N-N-N-N-N-N-N",-321.42804,75.37165,106.6481,56.477547,13.7762375,47.321102,31.796892,27.862957,15.650472,21.2546,17.120533,18.17532,8.014617,21.27458,-1.2194122,15.655364,3.2421203,17.166027,10.150619,19.563139,11.75153,17.030766,-0.6635362,11.711413,-4.7531776,13.490951,0.40062994,0.3061376,22.34778483232252,8.435152113827836,0.0219910996214573,0.1238294270579401,0.0698627467178336,0.05616842,5.0
audio_1065.wav," My favorite place to visit is Japan. I have been there twice. What's 2019 and one in, it's in 2023. It is a very long flight. Even in Jairact, you're looking at 12 or 13 hours from DC to Tokyo. If you have a layover, it's going to be even longer. My favorite foods to have there is definitely ramen, of course sushi. The main thing that I must always get when I get there is the tuna onigiri. Tuna mayo onigiri from Family Mart. I can't explain it. It just tastes really good. Don't go to 7-Eleven. It's not as good. Is there a particular time? The best time to go to Japan is not the summer or September during the rainy season. The best time to go in the spring for the cherry blossoms or alternative in the fall when the leaves start changing colors and the temperature is perfect.",-279.1497,98.65757,101.20211,59.855736,-21.20508,53.257645,28.62773,39.099285,-7.2748146,29.587534,-7.4229336,22.171534,-12.477089,18.569921,-8.387876,18.314016,-2.272343,16.025957,-4.9170804,11.9235525,-7.026628,11.822417,-15.180844,12.158928,-3.6728868,10.009733,0.3331434,0.30765152,20.086363612797808,5.680762352796056,0.0056626385858313,0.1429724414788419,0.1552830575246272,0.0520257,4.5
audio_1066.wav," I'm going to do it. I'm going to do it. I'm going to do it. I'm going to do it. I'm going to do it. I'm going to do it. I'm going to do it. I'm going to do it. I'm going to do it. I'm going to do it. I'm going to do it. I'm going to do it. I'm going to do it. I'm going to do it. I'm going to do it. I'm going to do it. Go on, About How we Won't Chぁue She I'm going to do it. I'm going to do it. I'm going to do it. I'm going to do it. I'm going to do it. I'm going to do it. I'm going to do it. I'm going to do it. I'm going to do it. I'm going to do it. I'm going to do it. I'm going to do it. I'm going to do it. I'm going to do it. I'm going to do it. I'm going to do it. I'm going to do it. I'm going to do it. I'm going to do it. I'm going to do it. I'm going to do it. I'm going to do it. I'm going to do it. I'm going to do it. I'm going to do it. I'm going to do it. I'm going to do it. I'm going to do it. I'm going to do it now. Going to do it. Going to do it. Aaaahhh! ... ... ... ... ... ... ...",-496.0625,61.508015,103.45968,32.514126,33.363586,41.046955,44.485786,18.695677,-7.3570466,17.230799,28.536808,12.158442,-0.7188362,11.178728,10.800718,11.261475,10.533357,10.004323,5.889605,10.492305,12.280679,11.373647,7.8030586,10.630866,16.471401,9.159858,0.50768816,0.29948252,19.17516093260777,6.342584420439448,-0.1279082612633998,0.14130157124308,0.028633668920868,0.010595554,4.5
audio_1069.wav, I'm going to do it. I'm going to do it. I'm going to do it. I'm going to do it. I'm going to do it. I'm going to do it. I'm going to do it. I'm going to do it. I'm going to do it. I'm going to do it. I'm going to do it. I'm going to do it. I'm going to do it. I'm going to do it. I'm going to do it. I'm going to do it. I'm going to do it. I'm going to do it. I'm going to do it. I'm going to do it. I'm going to do it. I'm going to do it. I'm going to do it. I'm going to do it. I'm going to do it. I'm going to do it. I'm going to do it. I'm going to do it. I'm going to do it. I'm going to do it. I'm going to do it. I'm going to do it. I'm going to do it. I'm going to do it. I'm going to do it. I'm going to do it. I'm going to do it. I'm going to do it. I'm going to do it. I'm going to do it. I'm going to do it. I'm going to do it. I'm going to do it. I'm going to do it. I'm going to do it. I'm going to do it. I'm going to do it. I'm going to do it. I'm going to do it. I'm going to do it. I'm going to do it. I'm going to do it. I'm going to do it. I'm going to do it. I'm going to do it. I'm going to do it. I'm going to do it. I'm going to do it. I'm going to do it. I'm going to do it. I'm going to do it. I'm going to do it. I'm going to do it. I'm going to do it. I'm going to do it. I'm going to do it. I'm going to do it. I'm going to do it. I'm going to do it. I'm going to do it. I'm going to do it. I'm going to do it. I'm going to do it. I'm going to do it. I'm going to do it. I'm going to do it. I'm going to do it. I'm going to do it. I'm going to do it. I'm going to do it. I'm going to do it. I'm going to do it. I'm going to do it. I'm going to do it. I'm going to do it. I'm going to do it. I'm going to do it. I'm going to do it. I'm going to do it. I'm going to do it. I'm going to do it. I'm going to do it. I'm going to do it. I'm going to do it. I'm going to do it. I'm going to do it. I'm going to do it. I'm going to do it.,-507.25504,28.299255,38.170803,33.172386,30.077166,22.904728,23.229414,16.439121,18.835207,13.13681,15.428726,11.809545,12.081954,10.572457,9.13605,9.484516,6.8081656,8.557961,5.284489,7.665038,3.99212,6.780405,2.8847468,6.009904,1.7330052,5.4520826,0.3727169,0.29318598,16.814132473296198,4.801636557962057,-0.0015088031513196,0.1127395391820476,0.0360967556058526,0.014272094,2.0
audio_1075.wav," My favorite place to travel is to Ocean City, Maryland. I don't live far from there, so I get in the car, and then I just drive an hour and once I'm over the bridge to Ocean Pines, I am in Ocean City. The things that I like to look at, the local foods that I like in Ocean City, are the thrash or fries, which are... It's pretty much just local, just... It's just in that one place, the thrashers company. Dipping dots, which you can also get on the boardwalk, and pretty much anything on the boardwalk. And there's a one place that serves these burgers. I forget the name of it, but it's also on the boardwalk. And I like to go there, and you can go there in the summer, because there's a lot of people there, and you can also go in the winter, where there is a lot of... There's a festival of lights.",-301.32693,95.84859,91.29783,64.92476,27.995111,32.56875,18.872341,27.9951,8.0030775,25.64283,8.323686,16.946154,-4.4471793,17.939688,-5.2491174,15.696392,-13.4140005,13.709098,8.584498,14.516232,-10.203233,12.487172,-1.3440822,11.42439,-3.3250122,10.595942,0.44831523,0.30456194,18.173416350149008,5.41583821389773,-0.0111009780446801,0.1018202684489413,0.1721586607261714,0.045694713,5.0
audio_1078.wav, Shhh. Shhh. Shhh. Shhh. Shhh. Shhh. Shhh. Shhh. Shhh. Shhh. Shhh. Shhh. Shhh. Shhh. Shhh. What. what. Shhh. What. Oh. Shhh. I'm not going to be able to do it. I'm not going to be able to do it. I'm not going to be able to do it. I'm not going to be able to do it. I'm not going to be able to do it. I'm not going to be able to do it. I'm not going to be able to do it. I'm not going to be able to do it. I'm not going to be able to do it. I'm not going to be able to do it. I'm not going to be able to do it. I'm not going to be able to do it. I'm not going to be able to do it. I'm not going to be able to do it. A Wait. Bringing. I'm sorry. I'm sorry. I'm sorry. I'm sorry. I'm sorry. I'm sorry. I'm sorry. I'm sorry. I'm sorry. I'm sorry. I'm sorry. I'm sorry. I'm sorry. I'm sorry. I'm sorry. I'm sorry. I'm sorry. I'm sorry. I'm sorry.,-352.25314,86.93029,72.422874,53.094234,12.641962,44.429764,40.770576,35.10628,-23.468151,19.646639,33.521534,26.454954,1.0127889,21.618366,19.249006,19.998531,15.764971,17.031597,3.0039175,16.086485,-3.3341048,16.240221,-0.9189007,14.982467,8.212137,13.20227,0.35614058,0.31372276,22.330947178837683,9.249136229582708,-0.0019266519630134,0.1792314455784556,0.1223654656433073,0.051035587,5.0
