audio_1290.wav," There are many show times that when I say I had the best day of my life, we are just humans and sometimes you often think we if we happen to serve it or not, well it depends on how presenting of the best day of my life is when I thought kids of different age labelled with the help of my church friends and such, it was a really nice feeling being able to do that makes your heart flutter.",-442.1596,161.24817,18.275198,52.727257,4.2490287,33.12053,4.67179,24.628029,-10.897677,21.24964,-6.2815614,17.45462,-10.768757,16.05255,-2.536076,14.115458,-6.8078346,12.922255,-4.45552,11.51093,-7.1812363,10.700446,-1.1490549,7.878079,-6.00709,9.622566,0.41921216,0.3337513,17.779251791300197,5.416621923516257,-0.0009414751988313,0.1171112165816946,0.332941252329606,0.018383024,3.0
audio_1296.wav," See the best day of my life is when I was 8th class, my English teacher asked me to come on to the dies and she actually, she really didn't ask me to give a speech on my mother. And I was very nervous and just I went there and I hit on there, I put my head down, just looking at the floor. That's it. She is saying say something and the people who sit here in front of me all laughing by seeing me because I was nothing speaking there because I don't know how to speak and how to start the speech regarding my mother. Even about my mother I couldn't speak and by that the critical situation I chained my mind to speak influently in my future.",-297.7198,131.21494,66.439354,41.086227,-14.261249,40.54791,16.763992,40.688606,-15.276524,22.356142,-8.055205,17.507229,-7.6513247,18.915987,-29.19706,24.753197,-2.3561478,15.532208,-6.2520704,16.075832,-0.37631273,12.83092,-0.10023578,13.075142,-17.098595,13.962922,0.37513018,0.31268194,20.11771220489798,5.963461288034379,0.0067210392028179,0.1270207215124007,0.1692983934038871,0.045515303,2.5
audio_1298.wav, The best day of my life is the moment my teacher announced that in a school I scored the highest marks in my class. Everyone appreciated me. My friends were smiling with pride. My teacher was happy and my classmates were surprised when I told my parents the field proud and the moments still I remember. And I enjoy those moments. The best day is all my school days. We are enjoyed.,-369.59888,133.41632,51.039955,61.481007,-3.8969376,34.31234,8.90143,25.342457,0.6054229,16.633791,-2.7939734,20.011124,-15.389209,16.934916,3.4306016,13.1788645,-9.337221,16.63778,-5.794494,10.774521,-4.468987,10.578939,-3.3560853,10.669773,-3.1095746,7.646521,0.3489985,0.32311964,18.55160632369303,5.428457504015822,0.0118607636252304,0.1316544817839789,0.1773664772727272,0.036901068,2.5
audio_130.wav," The people are saying the fruits are minimal, they send the market, they just use fresh water, fresh fruits, fresh vegetables, sound ear in the market was just 20 kg per, I am sorry, 20 rupees per kg, 20 rupees per kg and according to people they can buy the fruit according to the best price. The crowd will change throughout the day from morning to evening, there is no such crowd in the island of only butter around 10 to 11, the crowd were increasing and even the evening the crowd was much better.",-295.1566,63.631184,70.31878,34.644836,12.456001,19.043394,13.44427,23.677984,-4.7365823,14.664877,6.823272,11.545956,-6.742935,12.78975,-0.013799406,11.508166,-7.093323,10.815952,-0.23153134,10.601294,-9.723555,9.326599,-5.5482707,9.098009,-7.341171,9.346703,0.37065402,0.32901576,17.44234455346391,4.550371767999954,0.0194301857005675,0.143850439784746,0.1672898882621139,0.030178769,2.5
audio_1304.wav," there. Is it? All right. So, we're just joining to that. I'm saying that we're for initial interview. And then there are no more. I think I guess you can use it with the swing and the slide where you can do activities such as do please. You can also do like playing and play around and also do activities such as flipping, commentary, activities with your classmates and with your friends. What? What's on the big?",-398.42627,147.78601,48.360367,63.906555,10.747953,39.652863,18.501427,32.50465,-11.054338,23.771418,-9.479748,19.527056,-11.636159,18.576607,-5.437821,18.026266,-11.778898,17.19828,-4.0081277,12.15023,-7.503574,12.22639,-7.1939096,13.958157,-2.1517012,11.131312,0.396285,0.33475184,19.10027928809959,5.982823722992408,0.0269401317991492,0.1535463295291512,0.2228031503760649,0.02877281,2.0
audio_1307.wav," I can describe a school playground like Paradeis. There are particular games and activities that you can play there and you can play with your friends and classmates as well. And I can hear some sounds, a happy sounds while I'm in a playground. So I am really loved to stay at the school playground when our class is not yet starting. So, yeah, I love school playground and I can describe it or I can say that playground is what children's favorite place in the playground. It's a very favorite place in the school, as I'm there.",-325.53745,150.7584,31.286688,56.171303,-7.149777,41.423775,-3.4807923,32.887314,-18.398499,19.734287,-15.540975,21.381422,-12.536905,16.060848,-10.589411,16.006441,-5.0065684,15.837903,-9.0035515,11.069407,-12.737572,11.32521,-5.834276,11.211675,-2.6721158,9.196965,0.36301112,0.320865,19.77586740307829,5.988068410033844,-0.0108566421825202,0.1562705377955758,0.2561906158479766,0.03565924,3.0
audio_131.wav," I am about to describe the scene of a crowded market. In the crowded market, people are selling and buying many things. They are selling things like vegetables, fruits, meat, fish and also the provisions that I need it by people. And also there are a certain amount of people who are buying the provisions that are sold by the vendors. I can hear multiple sounds in the market such as the vendors demanding that they pass product, spits and cheap off when compared to the other products. The crowded market scene changed throughout the day because in the morning it is very crowded but as the day goes by when it reaches afternoon it is little crowded and when it reaches the evening it is not crowded at all. So this is how a scene of a crowded market seems like. Thank you.",-357.7547,89.729004,99.178665,53.50862,30.977158,34.90139,1.0648245,28.74616,-12.417149,22.518822,-4.253706,21.085758,-9.854138,15.394937,-6.6665654,16.013239,-2.8172581,13.7548,-4.085459,10.315348,-5.022726,11.199869,-4.380643,10.667406,-4.260168,9.288033,0.355719,0.32839724,19.0682326242311,5.378329068774303,0.0031754245041804,0.1213140589749534,0.1389490357095314,0.0428004,4.5
audio_1312.wav," I'm going to play a good playground will be large with many different surfaces. The playground must be spacious and outdoors, but they must be also secluded for children. What happens in the game we CTRL, click on the side of the game taking place.",-498.93607,178.78815,11.659976,47.96725,-10.498023,29.515247,2.5486617,23.269417,-5.3709893,18.281591,-12.988288,20.12752,-7.739306,15.001486,-1.8709567,12.726184,-0.93348026,11.818478,-2.4404554,11.512245,-11.278636,16.158215,-1.9425884,9.011601,-5.5318556,10.18958,0.43723258,0.32228386,17.531924887592123,5.217839548821762,-0.0049347850768032,0.1097631159583541,0.3207999748400083,0.0151087465,2.0
audio_1313.wav," My school playground is very big. It's very huge. There are trees at the boundaries. All the trees cover the edges of the playground. And there were children approximately at 30 to 40 who play daily in the playground. I heard birds chirping, water falling from the water cooler. And the wind touches the leaves of the tree. And the tree leaves genses them. The birds plays with the tree leaves. They make their nest on the tree. The school children playing cricket. And on the other side, some children playing football. Football is a popular game between children nowadays. It can be seen playing by the children in maximum playgrounds of the school.",-373.94067,93.48762,96.61036,45.30945,14.920891,27.735006,21.093683,31.182241,8.878482,20.127209,-1.1689048,18.77144,-4.925643,17.011007,-9.159339,15.86398,-4.342549,14.017485,-6.539152,12.667618,-4.5237,10.190861,0.46133777,9.845581,-3.7633243,10.898976,0.38127342,0.3245575,18.026932445079154,4.857131766324705,0.0050425843945598,0.1284849410006486,0.1163430178381256,0.030820804,2.0
audio_1314.wav, Here is so exploring my favorite spot and I'm ventured to the beach where clear waters warm sands and tall ponds create a perfect even of relaxation and joy. Also a detailed declaration of my favorite place to visit were a grizzling waters back in South St. Green Bear Fit. Also I have my favorite place to visit which is my favorite place is Bewa. The Bewa is full of memories like my friends and my friends we go there and make memories and talk with each other and look top like that. I like to go there because yeah.,-306.3015,114.30828,29.876896,64.0206,-8.359998,39.061703,9.678804,33.10356,-20.158262,22.67113,-13.859334,20.096739,-16.53246,16.319723,0.26331815,15.23646,-16.04699,19.034437,-8.093466,14.055535,-13.876039,13.185611,-4.8895617,12.736356,-7.502045,11.263362,0.29282174,0.3302585,19.74197139254124,5.620408224330196,-0.012073595186027,0.1993555329769348,0.2273699042682128,0.04872743,3.0
audio_1318.wav," My favorite place to visit is our province, which is Bikol. And I love Chambali. I love going to Bikol because there's local foods or dishes that which I love to eat there. I can eat seafoods there that we can get from a sea. And we used to travel or to go to our province, which is Bikol, when it's holy week. So, where our whole family is gathering our holy week or spend our holy week to our province. And we bond and we celebrate or spend the holy week together with our whole family.",-331.26346,141.45232,34.908672,57.19394,-3.649021,38.854237,0.55119336,35.295734,-16.941954,19.865215,-14.512844,19.961836,-12.554003,15.121804,-14.949074,17.045513,-6.583325,15.639539,-8.968561,11.769432,-12.7685995,10.946755,-7.4060397,12.31818,-2.1955132,9.279773,0.3474759,0.32027206,19.95719081860669,5.980091540795369,-0.0174383645648304,0.1567205875800786,0.2451983077076677,0.03472771,2.0
audio_1325.wav," My goal is life is to have a happy and peace life and always a rich and I want my goal is to have money more money because my goal is important for me because everything I don't have money or my family is not that rich so I just want to give my family a bridge or a life that they deserve and the challenge is that I face to achieve this goal is money that's why I need money to achieve my goal and also the time I need the time for this goal and like what I said my goal in life which is to money, motivates me",-289.54565,115.10957,28.875444,69.23865,-2.2929914,45.308712,4.652845,34.473576,-18.419043,24.713238,-6.254519,21.571903,-18.863918,18.473524,1.7513975,16.566946,-15.839397,19.154215,-5.8177223,14.11188,-18.422033,15.52598,-2.7471447,12.166542,-10.572787,12.608656,0.2859696,0.32761142,19.98796754400711,5.612720601823536,-0.0086697307423445,0.1891312642758799,0.2242643541167465,0.054456856,2.5
audio_1326.wav," I think the goal that I am actually very nice to be happy, completely happy because I think in this generation it's not easy to achieve. And also just being here, I like to achieve my small means of life such as having my own space because it's not easy to live with my parents right now. So I think that this may really go as of the moment. What challenges would you face? I think that the budgeting because it's not easy to have your own space when you are sure to be the budget. That's why I think that is the hardest part of achieving that goal as of the moment. What motivates you to stay focused on the payment of our achieving goals? I think the idea of living, the idea of being alone and having my own space. I think that's what makes me so good.",-343.35596,121.53078,60.715355,65.53123,14.320024,43.569565,18.902044,39.024273,-13.021101,24.54663,-9.778321,22.570448,-10.136939,19.325775,-5.042695,18.545527,-17.440638,17.015312,-5.0605865,14.409869,-9.791935,13.595533,-13.685695,14.98261,-4.1099615,12.329166,0.3655452,0.3263648,19.72871288792405,5.89842669147627,0.0150028753870576,0.1459209866513145,0.1928146736055644,0.033397738,2.5
audio_1329.wav," I can describe my goal in life, or I can say I hope to build on my skills and gain more responsibilities within this company. And I am eager to learn from experience team members and eventually take on leadership rules. I am eager to learn from experience team members and eventually take on leadership rules. I am eager to learn from experience team members and eventually take on leadership rules. I am eager to learn from experience team members and eventually take on leadership rules. I am eager to learn from experience team members and eventually take on leadership. I am eager to learn from experience team members and eventually take on leadership. I am eager to learn from experience team members and eventually take on leadership. I am eager to learn from experience team members and eventually take on leadership. I am eager to learn from experience team members and eventually take on leadership. I am eager to learn from experience team members and eventually take on leadership. I am eager to learn from experience team members and eventually take on leadership. I am eager to learn from experience team members and eventually take on leadership. I am eager to learn from experience team members and eventually take on leadership. I am eager to learn from experience team members and eventually take on leadership. I am eager to learn from experience team members and eventually take on leadership. I am eager to learn from experience team members and eventually take on leadership. I am eager to learn from experience team members and eventually take on leadership. I am eager to learn from experience team members and eventually take on leadership. I am eager to learn from experience team members and eventually take on leadership.",-476.73135,160.60953,16.886917,45.77811,4.6795454,24.906189,1.1948707,22.212591,-6.8012075,16.65423,-7.7353377,18.159996,-3.5082858,12.249498,-5.6349726,13.553074,-5.988863,12.592362,-6.289995,10.622224,-6.5922318,10.077109,-2.7007139,9.337793,-2.9898171,6.9100823,0.49277952,0.31227788,17.335693396569962,5.424564419270103,0.0060351787420192,0.1139623044330834,0.3130538014177316,0.014922147,3.0
audio_133.wav," So, the topic is the scene of the crowded market. So, after the COVID, after the COVID, the market is very crowded. So, the people are buying and selling new technologies and new features of phones, laptop and electronic devices. So, that they can easily work them. And most likely, we can hear in the market is like cheap products and good features and good technologies that are inside it. And throughout the technologies, increasing day by day, all people are by only technology-related products like mobile, laptops, tablets, earbuds and Bluetooth connecting devices. Thank you.",-335.5622,84.96859,102.25595,59.272346,20.257565,35.446205,28.04506,34.58236,8.752582,18.675072,-3.1073127,21.701052,-4.658336,16.360907,-0.36872998,13.89803,-0.009999553,16.330933,-15.981118,17.136417,-4.42749,13.365246,-6.0072007,14.234119,-10.790486,11.482117,0.320048,0.31881273,19.650998401964035,5.358584032734775,0.0274026628920151,0.1407729965175977,0.1161987925734878,0.048212882,2.0
audio_1332.wav," My goals in life are ultimately to achieve success in life. My goals are to also have happiness, prosperity, and every area in my life, and the freedom and peace within to be able to carry out my goals. My goals are also heavily influenced to the hardship of my parents have had to endure such a peace and radical for the simple fact of being immigrants. It's an extremely difficult time to endure due to unemployment and living in poverty. And a low degree of education they receive from their countries. My goals are so important to me because I view it as a way of barely getting by out of hard life. My goal consists of me being first person on my mother's side to ever graduate from college. My goal also consists of making parents proud of their daughter. A daughter that will give them more comfortable life.",-305.68405,138.25359,41.723793,60.555218,-2.1053417,43.39573,16.010866,37.689796,-25.34834,29.413578,-8.987592,18.76838,-19.669762,18.561384,-8.573377,16.006262,-10.824825,13.031152,-9.882636,11.218547,-6.532952,11.336586,-5.847275,10.952512,-4.43242,9.960809,0.3228677,0.32636043,19.611151121422523,5.912056901297943,0.0072138077468951,0.1713465536017825,0.2057296866679978,0.048346665,4.0
audio_1333.wav," So the greatest goal that I have right now is to be able to be a successful programmer because being a programmer is already in my profession, in my profession, I am a program student. Although I know that once I graduated, there will be a lot of challenges, especially there already a lot of competitions and another application right now since information, courses are already increasing. But it will not make me discouraged instead, it will motivate me to study more so that I can be a work full applicant.",-315.53232,110.68212,37.65455,62.6618,-3.7414358,41.75034,2.5147438,34.16165,-15.047767,24.36092,-15.97817,23.930763,-13.7816925,17.764147,-15.624768,20.703619,-11.122314,16.244133,-11.058915,14.21103,-14.529501,12.242148,-8.333408,12.239191,-10.454207,11.426087,0.2960494,0.32997122,20.539053927246005,6.2241936381465415,0.0313511923345206,0.1897150099543228,0.2301661316643214,0.050654665,3.5
audio_1335.wav, Every person has a goal in his life. He works towards it. Struggling day and night for his goal is what we all know. I always love reading books. My goal in life is to become a writer. I am the only child of my parents. So basically I was very lonely. It made me forget the fact that I am lonely. As my goal I wish to improve my education skills and analytical skills. Inkulkit redefined qualities among young miles and make them teach barriers. Every person must have well defined objective in life. It helps us. A life with a specific aims given by dilatated to a person. Gifts.,-350.74207,91.75013,109.59411,43.48231,6.1146736,29.33741,33.624577,31.941925,5.6102014,19.913908,9.027899,16.503777,2.6659982,15.927865,-5.7874784,15.84146,-1.221617,14.679829,-3.187385,11.833113,-1.8163834,9.527485,5.090963,9.905014,1.7746521,10.270232,0.41970962,0.32693344,17.814059288237537,4.926751961293145,-0.0001554374374679,0.1147456813752801,0.1010209186135516,0.037510898,3.0
audio_140.wav," The market itself is in Hong Kong and it's a very popular tourist market. There's lots of tourists from all over the world that go through there. There's just a general background hum of activity. The goods that are sold in the market, they are sort of goods at a touristy, things such as magnets with Hong Kong on them. Other touristy paraphernalia like chopsticks, which is the traditional dress of the women in Hong Kong. Things with Chinese motifs like dragons and Jade Jewry. It is rather noisy. You can hear the vendors haggling with the customers. It's busy from morning.",-330.34412,89.37768,76.22727,58.747005,8.647516,42.410812,13.755492,37.252476,0.21099304,26.388828,-11.68703,21.71574,-10.582665,15.7918625,-0.82819164,16.723417,-10.350164,17.466442,-9.226191,12.549184,-2.249323,12.611452,-15.232226,13.656985,-1.2514585,11.617121,0.26104435,0.31489912,21.433178052398382,6.269852293613475,0.0025065944679341,0.1974324719649093,0.1765256319056176,0.053247355,5.0
audio_142.wav, Music A Slaughter Sikpia Shura A aussikpa A Q or a Q I am the one who is the one who is the one who is the one who is the one who is the one who is the one who is the one who is the one who is the one who is the one who is the one who is the one who is the one who is the one who is the one who is the one who is the one who is the one who is the one who is the one who is the one who is the one who is the one who is the one who is the one who is the one who is the one who is the one who is the one who is the one who is the one who is the one who is the one who is the one who is the one who is the one who is the one who is the one who is the one who is the one who is the one who is the one who is the one who is the one who is the one who is the one who is the one who is the one who is the one who is the one who is the one who is the one who is the one who is the one who is the He is the one who lives on the earth.,-346.72794,96.438774,91.443535,58.676167,15.655342,44.00276,45.195915,32.98126,-16.152573,25.375418,39.427887,19.111904,3.744355,23.18308,10.39055,16.059164,3.7623432,15.6383915,-1.3497772,17.81118,12.85449,12.8913965,8.332358,13.256269,7.6691036,13.62761,0.35019496,0.31929594,23.55527308764979,9.214809551520664,0.013721593632306,0.1548418812569685,0.1017864037574288,0.046178266,4.0
audio_144.wav, I'm going to be a little bit more careful. I'm going to be a little bit more careful. I'm going to be a little bit more careful. I'm going to be a little bit more careful. I'm going to be a little bit more careful. I'm going to be a little bit more careful. I'm going to be a little bit more careful. I'm going to be a little bit more careful. I'm going to be a little bit more careful. I'm going to be a little bit more careful. I'm going to be a little bit more careful. I'm going to be a little bit more careful. I'm going to be a little bit more careful. I'm going to be a little bit more careful. I'm going to be a little bit more careful. I'm going to be a little bit more careful. I'm going to be a little bit more careful. I'm going to be a little bit more careful. I'm going to be a little bit more careful. I'm going to be a little bit more careful. I'm going to be a little bit more careful. I'm going to be a little bit more careful. I'm going to be a little bit more careful. I'm going to be a little bit more careful. I'm going to be a little bit more careful. I'm going to be a little bit more careful.,-403.70514,93.684105,101.0932,56.47664,35.324753,46.057346,34.293747,21.874691,-13.194478,25.372385,26.036299,14.386836,4.5238767,18.414366,9.776576,14.32989,8.809557,13.960748,6.718396,14.378585,14.194859,14.373774,13.752592,11.299632,14.782654,12.217899,0.40580994,0.2973231,20.64271247203732,7.85214892654658,0.0067807266962547,0.1156226524479006,0.0754409700647967,0.036423985,5.0
audio_146.wav," I'm sorry. I'm sorry. I'm sorry. I'm sorry. I'm sorry. I'm sorry. I'm sorry. I'm sorry. I'm sorry. I'm sorry. I'm sorry. I'm sorry. I'm sorry. I'm sorry. I'm sorry. We lost together. We lost her. We lost her. We still lost her. We need to sort her out. We don't know. You're gonna find her with just one check. Talk. I'm sorry. Talk. I'm not going to be able to do it. I'm not going to be able to do it. I'm not going to be able to do it. I'm not going to be able to do it. I'm not going to be able to do it. I'm not going to be able to do it. I'm not going to be able to do it. I'm not going to be able to do it. I'm not going to be able to do it. I'm not going to be able to do it. I'm not going to be able to do it. I'm not going to be able to do it. I'm not going to be able to do it. I'm not going to be able to do it. I'm not going to be able to do it. I'm not going to be able to do it. I'm not going to be able to do it. I'm not going to be able to do it. I'm not going to be able to do it. I think I would be able to do it. I'm out there instead of going out. I'm out. I think I would be able to do it. I think I would be able to do it. I think I would be able to do it. I think I would be able to do it. I think I would be able to do it. I think I would be able to do it. I think I would be able to do it. I think I would be able to do it. I think I would be able to do it. I think I would be able to do it. I think we, tomorrow, two two three five five five five five five five five five five five five five five five five five five five five",-366.8351,86.11077,134.63916,81.52319,29.880503,49.508858,4.2284765,26.014618,8.613496,22.4385,1.0328697,15.924558,7.4474115,17.859055,15.487852,16.625921,3.7663608,14.509257,-0.9598344,17.30841,8.056941,14.581623,9.019346,10.857935,0.16043854,10.8172655,0.3976022,0.3167567,22.03832154599425,8.3131318049163,-0.0407878764574632,0.1542141865975229,0.0485724989736818,0.061744183,2.0
audio_147.wav,,-441.7522,49.5859,42.290577,57.603962,23.537329,31.322172,7.682167,15.530922,2.93056,12.048306,6.5852737,10.924865,10.016253,14.8322525,8.004746,13.000122,2.6390412,9.20084,-0.9163924,8.424472,-0.6602233,6.8940077,0.91811115,6.105274,0.659208,5.7113357,0.32707992,0.35007936,17.328892778529884,7.506966658688703,-0.0025491606701997,0.1431768869880504,0.0277017986647886,0.027882272,3.0
audio_15.wav," My favorite hobby is reading books. I read whenever I have freedom. I read many kinds of books such as history books, science books. Sometimes it is novel and popular. Maxines reading has a lot of advantages. First, reading is a cheap way to get information and entertainment. Moreover, you can keep a book forever and read it many more times. The reading is a convenient way for me to acquire a wonderful source of knowledge. Furthermore, reading book will contribute to my vocabulary expansion. The more I read, the more words I expose it to. And they will inevitably make their way to my mind. That therefore also helps to improve my memory when I read a book. I have to remember this plot's character, characters name, events so that my memory will become much better. Additionally, reading book is the best way to set.",-320.5434,114.153984,63.700356,69.878555,7.9578185,43.304394,13.23891,34.095646,-24.63863,29.847742,-22.951813,22.048162,-28.460957,20.057617,-13.782585,19.748055,-14.597112,15.220482,-12.869569,12.266861,-6.6110306,10.999062,-2.837743,11.635316,-9.447498,10.494716,0.29809076,0.33729225,20.444958124940523,6.061209820003249,-0.0154845199826359,0.1743812803347459,0.2023499380158413,0.07391217,4.5
